Name,Comment,Time,Likes,Reply Count
Suthirak Prom,This channel is awesome. Thanks for sharing. Subscribed.,2019-11-16T16:13:04Z,2,0
Babu Neelam,This is very informative. Is the code used in this course published like in github?,2019-11-12T05:03:44Z,1,1
edureka!,Thank you. Please share your email id with us (it will not be published). We will forward the code to your email address.,2020-06-15T18:29:13Z,0,
saritha prabhu,Awesome video ma'am,2019-11-10T14:59:04Z,0,0
Cyber-Physical Power System,Thank you so much edureka...,2019-11-07T03:42:05Z,3,0
Premm R Patel,It's so well explained - Excellent delivery of content and command on subject. Brilliant content and easily made understood even for first timer like me,2019-11-06T10:14:01Z,50,1
edureka!,Thank you for appreciating our efforts. Do subscribe to our channel and stay connected with us. Cheers :),2019-11-06T12:29:02Z,8,
Andrew S. Scott,Very interesting information. 🤔,2019-11-01T18:46:32Z,2,0
Riyaz Ahmed Pathan,"You are amazing
😍😍😍😍😍",2019-11-01T09:14:39Z,1,0
Abdullah Al Masud,But as python uses interpreter how can I protect my code from others,2019-10-27T09:35:40Z,0,1
edureka!,"You would have noticed that a .pyc file gets generated when you run a python script. This is the compiled byte code. Python scripts can be substituted by the byte code without affecting the execution. But if you look up the contents of .pyc file, it is quite difficult to make sense. The python documentation states that .pyc files are 'relatively hard' to reverse engineer.",2019-10-30T12:50:42Z,0,
SATISH KUMAR,This video is really very helpful.Thanks Alot.,2019-10-24T15:21:00Z,4,0
a s,the DL solution discussed are enough to create some AI about virus recognition ?,2019-10-24T09:45:59Z,1,1
edureka!,"Yes, it is. But you should know more about what Cyber Security is and how the virus is coded so that you can make an AI that searches for certain patterns and deletes the Virus. Hope that helps.",2019-12-13T10:17:14Z,1,
Nidhi Prakash,Thanks a lot! Couldn't find a better video with such well assembled content for AI.,2019-10-23T14:01:05Z,20,1
edureka!,Thank you for appreciating our efforts. Do subscribe to our channel and stay connected with us. Cheers :),2019-10-24T14:24:29Z,5,
Shashidhar T Halakatti,"This video is highly knowledgeable in this domain, those who want to learn they can make this video highly optimize to gain knowledge in Artificial Intelligence.",2019-10-23T06:49:19Z,0,1
edureka!,Thanks for the compliment Shashidhar! We are glad you loved the video. Do subscribe to the channel and hit the bell icon to never miss an update from us in the future. Cheers!,2019-10-23T13:17:06Z,0,
Brayo Odhis,Would love a link to the dataset used😇,2019-10-18T14:05:23Z,1,1
edureka!,Please mention your email id (it will not be published). We will forward the dataset to your email address.,2019-10-21T16:57:58Z,0,
RJ Paisa Kamao,Exceptional video..,2019-10-13T07:57:11Z,2,0
houssein bj,"First of all i want to thank you for this, just mazing and simple to understand. Is there a pdf version of this course ? Thank you",2019-10-07T18:22:02Z,0,1
edureka!,"No, there is no pdf document of the video, but you can refer to our AI blog series: https://www.edureka.co/blog/what-is-artificial-intelligence.",2019-12-26T12:33:10Z,2,
Rishi Kumar,"Lekha from edureka...
Thanks a lot sis",2019-09-29T06:48:41Z,2,0
Sulabh Shrivastava,The tutor is ourstanding. One of the best tutorial out their for beginners. She has done a commendable job,2019-09-28T13:19:36Z,62,0
Mo Meraj,Thank you  for the video but the my cocern  is here if the video is in  jupyter notebook is more helpfull for me. but again Thanks  alot for this video .,2019-09-21T19:08:10Z,2,0
Jihane BENdahan,Thanks a lot very interesting topic,2019-09-17T20:54:55Z,2,0
Narendra Rudra,Thank you,2019-09-17T20:53:18Z,2,0
MGR,*Python & R*,2019-09-17T16:39:26Z,0,0
SNR MEDIA,"Nice video
plz make another video for AI Practical application...",2019-09-16T17:54:00Z,1,1
edureka!,Thanks Shankar. You can also check out our Artificial Intelligence playlist: https://www.youtube.com/watch?v=4jmsHaJ7xEA&list=PL9ooVrP1hQOGHNaCT7_fwe9AabjZI1RjI,2019-09-17T06:21:45Z,0,
chander jeet,"@Zulaikha Lateef 
Take a bow 
Indeed great work",2019-09-11T07:56:08Z,0,1
edureka!,Thanks Chander! 😊,2019-09-11T11:25:46Z,0,
hellourthr,Superb explanation and motivating 🌺,2019-09-10T16:18:49Z,1,0
Joseph Paul's Fan,"Thank you very much 
More courses please",2019-09-10T05:33:18Z,0,0
manish pandey,"Thanks,  very good video. Could you also share dataset you have used??",2019-09-08T13:19:14Z,1,1
edureka!,Thanks Manish! Please mention your email id (it will not be published). We will forward the dataset to your email address.,2019-09-10T07:34:17Z,0,
pravin bhande,Superb !!  I couldn't think of someone explaining more easier than this version.. thanks a lot !!,2019-09-08T10:26:30Z,3,1
edureka!,Thanks Pravin! Don't forget to subscribe our channel https://www.youtube.com/user/edurekaIN?sub_confirmation=1,2019-09-10T10:54:17Z,0,
Collins Ikotun,Thank's a lot....Really helpful.,2019-09-08T10:06:49Z,2,0
Tech info,"Hello Mam, i m not related to software background.. i want to learn AI what are the sources we have... please let me know thank you",2019-09-08T06:37:03Z,1,1
edureka!,"Hi Sudheer, we do have various courses for AI like:

1. AI & Deep Learning with TensorFlow - http://bit.ly/2AlCEO7
2. Post Graduate Program in Artificial Intelligence and Machine Learning - http://bit.ly/2LFYAJ4

You can start from the basics by learning Programming Languages like R and Python so that it would be easier for you to understand AI and Data Science concepts.",2019-09-16T11:27:01Z,3,
Navratan Jagnade,Edureka is doing great work by providing such informative videos for free.,2019-09-07T18:01:02Z,2,1
edureka!,"Hi Navratan, thanks for being a part of our community! Cheers!",2019-09-08T06:45:32Z,0,
Navratan Jagnade,"Thanks a lot ma'am ❤
Really enjoyed the tutorial !",2019-09-07T17:57:45Z,59,0
Neeraj Chand,Well explained and clear voice,2019-09-03T04:30:57Z,3,0
SHAIL MODI,What is the difference between this video tutorials and the course whose link is mentioned??,2019-08-27T14:04:55Z,0,1
edureka!,"The full course video provides the basic knowledge and covers every topics you need to learn about. Whereas, the course provides in depth knowledge, you have instructors guiding you, online classes, tests and assignments.",2019-09-07T06:43:34Z,0,
Unai Lopez,"Where can i download the example datasets?
Thank you.",2019-08-26T09:48:56Z,0,1
edureka!,Please share your email id with us (it will not be published). We will forward the dataset to your email address.,2020-06-15T18:33:08Z,0,
Tushar Poojary,paused just to like the video. thank you for this :) Here is my comment!!,2019-08-26T09:30:42Z,13,0
Shamik Banerjee,"Thanks, ma'am. It was very very well made.",2019-08-26T02:01:22Z,0,0
Gaurav Kumar,"mam your voice is sooooo sweet.
i love your voice and your teaching style.",2019-08-24T13:56:41Z,1,0
Bandi SrujanAbhishek,"it's a nice video ,thank you so much for your very good explanation mam",2019-08-24T08:42:21Z,1,0
MUJEEB SYED,This course on AI  is  exceptionally  good  and the presenter is a great trainer,2019-08-23T16:46:10Z,9,0
Programming ORION,"Mam, Could you please provide the same Weather dataset on which you have worked in this tutorial.",2019-08-22T06:59:23Z,3,1
edureka!,Please share your email id.,2019-08-22T07:50:17Z,1,
Gouda P,"Thanks for sharing the knowledge free, can you please suggest me where to start and where to end.. I am new to Data Science, please attach the links
#greatjobedureka",2019-08-21T02:06:48Z,10,1
edureka!,"You are most welcome. Start by learning Python: https://www.youtube.com/watch?v=vaysJAMDaZw and then Data Science: https://www.youtube.com/watch?v=-ETQ97mXXF0
Don't forget to Subscribe to our channel.",2019-08-21T10:30:14Z,5,
Talha Zaheer,"If you want to have your first step move into the field of Artificial Intelligence, then this course is the best on Internet. Great job!!! Loved every minute of it. Keep producing such content for free.",2019-08-17T16:05:18Z,488,1
edureka!,Thanks a lot Talha. Kindly Subscribe to our channel.,2019-08-20T11:47:17Z,58,
Seti Gershberg,Very comprehensive introduction that was presented in a way that was clear and concise.,2019-08-16T01:11:31Z,31,1
edureka!,Thanks Seti.,2019-08-16T05:14:03Z,4,
Pavani T,@edureka Could you please share jupiter notebooks used in this session ?,2019-08-12T05:13:15Z,1,1
edureka!,Please share your email id.,2019-08-13T07:47:20Z,1,
Sukesh Chand,Excellent! The speaker is a good communicator. Thanks Edureka.,2019-08-11T18:30:38Z,7,1
edureka!,You are most welcome Sukesh.,2019-08-13T07:48:47Z,0,
vaibhav TIWARI,"Very Good Video, explained the basic idea of overall AI in a very short time. Thank you so much.",2019-08-05T18:26:25Z,38,0
Jasmer julani Jasmer,Thanku,2019-08-03T10:51:05Z,2,0
MOHAMMAD,"zulekha Mam, Really very good explaination with clear voice.",2019-08-02T12:07:09Z,5,0
JEEVAN K,Thanks for the video. Good explanation.,2019-07-31T12:55:59Z,6,0
Hariharan Shankar,Wow....what a speaker....she  Plays an important role in this video 👌,2019-07-27T02:50:13Z,1,0
Austin Rodriguez,Clear and great speaker. Thank you!!,2019-07-26T08:06:01Z,10,0
K-Alpha Tech,Thanks from Brazil!,2019-07-26T04:47:15Z,8,0
Naresh Ramini,"Such a insights, brilliant explanation mam....🙂 Halted listening to appreciate your efforts and explanation outcome! Great, thanks a ton!",2019-07-24T13:47:15Z,94,0
Audu Samson,may God bless you Edureka you have opened my eyes to many things,2019-07-21T19:36:04Z,10,0
lu×ury L!fe×tyle,I'm very thankful to you for this work.,2019-07-20T15:47:26Z,0,0
Aman k,Thanks mam1,2019-07-19T17:51:30Z,0,0
sarika royal,Excellent teaching,2019-07-19T14:40:06Z,0,0
M N Nadeem,"Awsome tutorial very well done  Zulekha. Your voice, way of teaching, pace and knowledge is too good. :)",2019-07-19T14:22:21Z,5,0
Saud Ansari,saud.ansari.14285@gmail.com    hey .. i am interested in your program.. but first i wanna know...in this video...was the full course covered or just the main topics,2019-07-16T10:11:46Z,0,1
edureka!,"Hi Saud, in this tutorial the main topics are covered. However, in the course there are many modules that cover all the AI concepts in depth along with industry level projects and assignments. You can check out the features of the course: http://bit.ly/2xvVmAQ",2019-07-16T14:53:17Z,1,
Shrinivas M B,The content is crisp and well made. Trainer is really good with a good voice. Thanks Edureka!,2019-07-16T10:07:52Z,42,0
Mahi MSD,"Who is the Trainer...
U HV done an exceptional job..
Well done ..excellent...
God bless you .....",2019-07-16T03:56:32Z,47,0
Tippanagiri Radhika,Very helpful,2019-07-15T16:30:40Z,2,0
Hamid Mamraiz,Very good tutorial. Thanks for valuable information and Great job :),2019-07-15T15:13:36Z,18,0
Arbaz Qureshi,thanks edureka ...,2019-07-13T04:56:55Z,6,0
Ramesh Kumar,Thanks a lot. Your way of presentation is awesome. Crisp clear.,2019-07-12T18:03:42Z,0,0
Dong Li,Thanks for the video. Very detailed and informative!,2019-07-12T14:14:12Z,1,0
corde jayjay,Wow,2019-07-09T01:20:17Z,2,0
Manjot Singh,Thanks for sharing. Looking forward to more videos. Very helpful and informative.,2019-07-09T00:51:57Z,19,0
Priya Kumari,Mam it is useful for nta ugc net,2019-07-08T17:07:41Z,7,0
Surajit Dutta,Thanks for this great video tutorial! Please let me know the Python IDE that you used in the demos.,2019-07-07T07:48:39Z,4,1
edureka!,Pycharm is the ide used in the demo. To know more about pycharm refer to this tutorial -  http://bit.ly/2SwIFj5,2019-07-09T05:37:36Z,0,
Sarfaraz shaikh,"Zulaikha, Much Appreciated your efforts to explain AI and Machine Learning concepts in such a well understandable manner. It was really interesting session with you. Thank you for your time and knowledge share.
One thing i would request you if you can provide best tutorial for learning Python. i am pretty new to Python and would like to learn.",2019-07-06T21:55:19Z,6,2
Sarfaraz shaikh,@edureka! thank you so much,2019-09-04T18:28:35Z,0,
edureka!,"Hi Sarfaraz, thank you for appreciating our efforts. We strive to provide quality tutorials so that people can learn easily. Here's a link to our Python playlist: http://bit.ly/2JiK2yN. Hope this is helpful!",2019-07-07T16:11:45Z,2,
vijay kumar,Great learning experience....,2019-07-05T15:53:33Z,22,0
Davison Matsvimbo,Thank u e!,2019-07-05T11:09:40Z,4,0
reuban chrisben,"how i look into the coding
can u share the github link",2019-07-05T04:35:49Z,2,1
edureka!,"Hi Reuban, thanks for watching the video. please share your email id with us (it will not be published). We will forward the code to your email address.",2019-07-07T11:21:16Z,0,
Neville Creativity Mentor,Well assembled content.,2019-07-03T11:25:23Z,2,0
Srikrithi Bharadwaj,"Thank You so much for this wonderful session. This was most effective, informative and most helpful resources. 🙏",2019-06-29T12:07:10Z,1,1
edureka!,"Hey Srikrithi, thanks for appreciating our efforts. We are glad you loved the video. Do subscribe to the channel and hit the bell icon to never miss an update from us in the future. Cheers!",2019-07-07T11:21:59Z,0,
Akshay Dahatonde,nice explaination...thanks maam,2019-06-28T15:28:25Z,10,0
Mohan Jagannathan,Basic requirement for AI,2019-06-27T15:20:10Z,3,1
edureka!,"Hi Mohan, You can go through this blog: http://bit.ly/2Jh1Ryq",2019-07-07T16:16:55Z,0,
Vikash Verma,Nice explanation..Great Job Edureka...,2019-06-27T06:31:23Z,2,1
edureka!,"Thanks for the appreciation, Vikash! Don't forget to subscribe to our channel.",2019-07-07T16:13:01Z,1,
curious420,Suggestion: Please split this video into shorter clips ( < 60 mins.) each of which can be finished in a single sitting. Thanks.,2019-06-26T08:26:49Z,1,0
Aduk Aleer Jook,She is very expert with good a niece voice with excellence explanation..thank you,2019-06-23T17:25:38Z,6,1
edureka!,Thank you for appreciating our efforts. Do subscribe to our channel and stay connected with us. Cheers!,2019-06-25T04:38:41Z,3,
K1-18-392 Satti Sai Venkata Krishna Reddy,I need robotics lecture for body parts and from forehead to foot of the robot please suggest this,2019-06-23T16:53:42Z,0,1
edureka!,"Hi Krishna, your request shall be processed. Kindly drop in your email ID so we can get in touch with you.",2019-07-07T16:02:47Z,0,
divyang shah,"Why are the algorithms like linear regression use the word regression,  regression meaning reducing or going down right?",2019-06-22T16:27:20Z,5,1
edureka!,"Hi Divyang, Regression also has a statistical meaning: 'a measure of the relation between the mean value of one variable (e.g. output) and corresponding values of other variables (input)'.",2019-06-27T04:21:38Z,4,
Neeraj Sharma,Very well explained . Great Job.,2019-06-22T06:06:40Z,5,0
Márcio,Tks from Brazil,2019-06-22T05:15:27Z,7,0
Vijayaveeran Rajandren,"time-57.32 reinforcement Learning's approach? Question= it is? ""trial and error method"" OR ""trail and error method""? Bcos voice-over pronounced the word as '""trial"" and text written as ""trail"" ???",2019-06-21T21:59:28Z,2,1
edureka!,It is Trial and error method.,2019-06-27T04:20:02Z,0,
Sujann Tamang,"love the content , just cleared all my basics..",2019-06-21T08:11:52Z,5,1
edureka!,"Thanks for the compliment, Sujann! We are glad that our video was of great help to you. Cheers!",2019-07-01T12:56:13Z,0,
Jalala v.k,thank you,2019-06-21T06:59:07Z,3,0
Suprit Reddy,Very informative!,2019-06-20T18:04:32Z,9,0
dr dr,thank you very much,2019-06-19T05:39:27Z,1,0
Tarun Kumar,"Thanks for the video.Can you provide dataset,it will be helpful, at
tarunkmr282@gmail.com",2019-06-17T17:36:27Z,1,1
edureka!,"Hi Tarun, you are welcome. :) We have forwarded the dataset. Please check your mail.",2019-07-01T12:55:00Z,1,
Nagender Reddy,"Actually I am from MBA background, to learn AI is there any prerequisite course to learn or directly can I learn AI",2019-06-17T10:44:13Z,3,1
edureka!,"Hi Nagender, to learn more you can get enrolled in this course: http://bit.ly/2XxznV1",2019-07-07T16:02:19Z,1,
PAPA CHOUDHARY,Thanks!,2019-06-17T09:18:58Z,3,0
Mahesh Sethi,"Edureka Requesting you to please upload some more videos on algorithms just for supervised, unsupervised and reinforcement learning.",2019-06-14T13:39:59Z,1,1
edureka!,"Hi Mahesh, we will process your request as soon as possible. Do subscribe to our channel and stay connected with us. Cheers :)",2019-07-01T12:53:57Z,0,
Rupesh Mehta,Use subtitles,2019-06-14T13:23:18Z,0,1
edureka!,We will definitely look into your suggestions. Do subscribe to our channel and stay connected with us. Cheers!,2019-07-07T11:25:10Z,1,
Ashish Rahul,"What is the purpose of non-linear SVMs? It's not helping us build a fence between the wolves and the rabbits 😅. Also, if you've converted the 2D data into 3D, shouldn't we be drawing a plane and not just a line?",2019-06-13T17:47:33Z,3,1
edureka!,"Non-linear SVMs are used to separate data that cannot be separated by drawing a single decision boundary. Basically non-linear data can be seperated using Non-linear kernels. They are used to solve multi-class classification problems. And yes, 3D data is drawn using 3D space. The representations in this tutorial are just to make you understand the concept.",2019-07-07T16:00:13Z,0,
Ashish Rahul,"Really helpful tutorial!! @2:03:18, the video says the final output depends on the number of votes each output is getting. What if both outputs get an equal number of votes? Is it even possible to get even number of votes?",2019-06-13T17:18:51Z,6,2
Ashish Rahul,"@edureka! Thank you for the quick and well-explained response 😁
Please continue posting such insightful videos. Rock on!",2019-07-07T20:38:38Z,2,
edureka!,"Thank you! Usually this does not happen, even if it does then you just add another test case or sample observation and then decide the output based on the result you get.",2019-07-07T16:03:13Z,3,
Ashish Rahul,"Great Tutorial! Really helpful! In the example of Tom & Jerry for unsupervised learning, the video says that the ML model forms two categories, one with images of similar features, and one with images which are different from that of category 1. What if I want Tom, Jerry & Nibbles? Will the ML model put one of them  in category 1, and the other two in category 2, or will it be able to make three distinct categories? Also, is the ""Classification"" type of problem solving (@1:00:43) only if you know you have only two categories?",2019-06-13T08:04:49Z,2,1
edureka!,"Thank you, Ashish! What you're talking about, is multi-class classification. This is possible in machine learning. Here the output is divided into more than 2 classes.",2019-07-07T16:03:57Z,1,
Shiva Gujju,"good noon Edureka, if possible to provide Data set link.....",2019-06-13T06:22:00Z,1,1
edureka!,"Hi Siva, please mention your email id (it will not be published). We will forward the dataset to your email address.",2019-07-01T13:08:46Z,0,
deepak abraham,Tnks a lot.. Grt course.. Plz add more courses,2019-06-13T02:49:26Z,3,1
edureka!,"Hey Deepak, thanks for watching the video. We will process your request as soon as possible. You can check out our other videos too. Do subscribe, like and share to stay connected with us. Cheers :)",2019-07-01T13:00:22Z,0,
Elakkiya Selvam,Engineering final year project AI project ideas video Podunga plzz..,2019-06-12T17:00:46Z,6,1
edureka!,"Hey, you can refer this data science projects blog for project ideas: http://bit.ly/2Xxy6xd",2019-07-07T15:59:29Z,0,
Argie Poul,"Very good video, it involves all artificial intelligence topics!
A question what you mean by bias in the video?",2019-06-11T15:40:20Z,9,1
edureka!,"Thank you! Coming to your question, in deep learning while calculating the output of a node, the inputs are multiplied by weights, and a bias value is added to the result. The bias value allows the activation function to be shifted to the left or right, to better fit the data.",2019-07-07T16:12:15Z,4,
Jaber ***,Very informative course . Thanks a lot,2019-06-11T15:26:11Z,6,0
kravi krukmani,To learn AI what are the basics I need to know? I'm a +2 boy of biology stream name Gokul,2019-06-11T01:11:12Z,3,1
edureka!,"Hey Kravi, you can go through this blog to understand what skills you need: http://bit.ly/2Jh1Ryq",2019-07-07T11:28:40Z,1,
Manikanta Durga,What is the difference between paid course and this,2019-06-10T17:27:07Z,1,1
edureka!,"Hi Durga, The paid course covers the concepts in depth with industry level projects. You can check out the features of the course: http://bit.ly/2xvVmAQ",2019-07-03T16:38:51Z,0,
Hitesh Kumar,You said that u have provided  links for Statistical maths and Box plots but i couldn't  find  it . It will be helpful if u provide links for it,2019-06-10T08:01:37Z,2,2
govind t,Thank you very much mam,2019-08-25T12:21:37Z,1,
edureka!,Statistics and Probability Tutorial: https://www.youtube.com/watch?v=XcLO4f1i4Yo,2019-06-11T19:49:05Z,0,
Prashant Kothari,What is scratch in reinforcement learning,2019-06-10T06:04:59Z,0,1
edureka!,"Hi Prashant, there is no such thing in reinforcement learning.",2019-07-03T16:36:20Z,0,
Suresh Paturi,Thanks Edurekha,2019-06-10T04:07:39Z,3,0
Nishant Sharma,Can I switch over to a career in AI at the age of 30 ?. Is it a good idea. plz suggest. I have no background in coding btw,2019-06-09T16:52:55Z,0,3
edureka!,"Hi Divya, make sure to master all the fundamental concepts to start your journey.",2019-07-14T16:35:02Z,0,
Divyarajsinh Solanki,i am just starting in programming and coding  what do you suggest?,2019-07-05T13:09:34Z,0,
edureka!,"Hi Nishant, you can switch but you'll have to cover a wide range of topics. You can go through this course to learn more: http://bit.ly/2xvVmAQ",2019-07-03T15:28:53Z,0,
ashish radhakrishnan,Finding it very useful. Thank you for sharing!,2019-06-08T14:44:38Z,16,1
edureka!,Thanks for the appreciation. Don't forget to subscribe to the channel.,2019-07-07T11:29:24Z,0,
Mohan Das,"Hey eduraka,in 35:05 what do mean by map there",2019-06-08T00:00:47Z,2,1
edureka!,The machine learning model 'maps' the input to the output by using the algorithm. The algorithm basically takes in inputs and gives you the output on the data you provide it. This is what I mean by mapping the input to the output.,2019-07-03T15:25:08Z,0,
Mohan Das,"In 35:00 what do mean by ""trained""there what does that exactly mean",2019-06-08T00:00:33Z,4,1
edureka!,Trained means that the model learns how to analyse the data set and form predictions by using Machine learning algorithms.,2019-07-03T15:23:26Z,3,
Zero King,This teacher told us clearly about and has a beautiful description all the video but the python from sketchs going fast .thank you,2019-06-07T11:05:15Z,94,1
edureka!,Thank you for appreciating our efforts. We will definitely look into your suggestions. Do subscribe to our channel and stay connected with us. Cheers :),2019-07-07T16:14:23Z,14,
Dindayal Agrawal,Great content,2019-06-06T13:24:32Z,4,0
DARK KNIGHT,Thank You Edureka ❤,2019-06-04T16:16:06Z,2,0
Sai Pavan,neural networks are bit confusing apart from the remaining topics. can I get the separate link regarding neural network ?,2019-06-04T11:56:58Z,0,1
edureka!,"Hi Pavan, check out this video https://www.youtube.com/watch?v=fv6Qll3laUU",2019-06-14T12:11:25Z,0,
Donny Donowitz 22,Thank you very much.,2019-06-04T10:26:11Z,2,0
RPA Developer Blue prism,"I have this doubt, NLP (Natural Language processing) and NLP (Neuro Linguistic Programming) is same of diff ?",2019-06-03T09:13:03Z,2,1
edureka!,"Hi Prakash, they are two totally different domains. In this course we've discussed about Natural Language Processing.",2019-06-06T10:28:07Z,1,
Ali Awan views,You said to learn python language link in the description but i couldn't find it,2019-06-03T05:23:58Z,2,1
edureka!,"Hi Ali, thanks for pointing out. Here is the link for Python Video: https://www.youtube.com/watch?v=vaysJAMDaZw",2019-06-03T05:50:29Z,2,
Mubasshir Khan,I love python,2019-06-02T17:57:03Z,7,0
R N,Thank you so much! Such a great tutorial for free!,2019-06-02T17:02:46Z,5,1
edureka!,Thank you for appreciating our efforts. Do subscribe to our channel and stay connected with us. Cheers :),2019-06-03T05:55:40Z,2,
Arul Franklin 24,Really nice please make a step by step use seperate video like 10min and 12min and shown on  please do next time,2019-06-02T16:28:12Z,1,1
edureka!,Thanks for the compliment! We will definitely look into your suggestions. Do subscribe to our channel and stay connected with us. Cheers!,2019-07-07T11:31:20Z,1,
Ankit Singh,what are the prerequisites required?,2019-06-02T16:07:27Z,1,1
edureka!,"Hi Ankit, for this course it is necessary that you know the basics of Python. Everything else is covered in the video. Check out this video for python training: https://www.youtube.com/watch?v=N0lxfilGfak&t=2s",2019-06-06T10:28:44Z,0,
UMAIR FVT,you use python ?,2019-06-02T10:41:51Z,0,1
edureka!,"Hi Umair! Yes, Python is used in this session.",2019-06-06T10:36:29Z,0,
Darkstar Dream,Oh my God thank you a lot edureka 🤩😘,2019-06-02T10:38:11Z,19,1
edureka!,"Hey, thanks for watching the video. Do give this video a thumbs up and subscribe to the channel for more amazing content. Cheers!",2019-06-03T05:56:36Z,5,
Mi2 Music & Vlog,Who ever wants to build career in artificial intelligence ...hit likes🤸🤸,2019-06-02T09:39:14Z,281,0
International Tourist,1st comment.....,2019-06-02T09:30:53Z,13,0
Pradeep Prajapati,Ma'am Cloud computing k full course ki video bhi upload kr do plz....,2019-06-02T09:24:33Z,4,1
