Name,Comment,Time,Likes,Reply Count
edureka!,"Got a question on the topic? Please share it in the comment section below and our experts will answer it for you. For Edureka AI & ML Engineer Masters Program Course curriculum, Visit our Website: http://bit.ly/2wziDSd (Use Code ""𝐘𝐎𝐔𝐓𝐔𝐁𝐄𝟐𝟎"")",2019-06-02T08:51:45Z,206,16
edureka!,Please share your email id with us (it will not be published). We will forward the code to your email address.,2020-08-19T14:06:01Z,1,
Mohit Wayde,"Can i get a hands-on practice on it, can you provide code?",2020-08-14T11:25:24Z,0,
Tech Addiction,"best course on artificial intelligence on youtube, thanks for this",2020-07-10T17:18:33Z,0,
Kunal Yadav,Please I want to learn artificial intelligence,2020-06-02T01:22:37Z,2,
Star Blogger,I love u guys u guys are doing a great job,2020-02-29T08:47:27Z,0,
edureka!,"Hi Mahesh, you can refer to this blog for details: http://bit.ly/2Lx2JBo
If you have more doubts, feel free to post your questions on Edureka Community:  http://bit.ly/2SwoSR0",2019-07-20T14:45:24Z,2,
edureka!,"Hi Aditya! Yes, we have randomly considered two predictor variables.",2019-07-20T14:41:24Z,2,
Mahi MSD,"Who is your trainer...
Excellent ...work ...",2019-07-17T05:08:40Z,1,
edureka!,"Hi Saif, Check out the details here: https://www.edureka.co/masters-program/machine-learning-engineer-training",2019-07-09T05:37:07Z,3,
Saif Hesham,"Can you please tell me , after completion of this course if, want to get any certificate for career purpose use then how to enrol for that. Please reply",2019-07-08T14:28:05Z,1,
edureka!,"Hi Tony, please check out this video https://www.youtube.com/watch?v=gmmV4drPTS4",2019-06-14T12:12:10Z,3,
MAHESH VARA PRASAD. S,how to develop and run an application in phython 3.7.3 verssion,2019-06-08T14:45:05Z,2,
Neel Moradiya,Has anyone completed the course,2019-06-08T06:45:26Z,3,
edureka!,"Hi Chandan! Yes, you can take up the course.",2019-06-06T10:31:47Z,6,
Tony Anudeep,"Can you please explain Random forest implementation, bootstrapping implementation??",2019-06-04T09:00:29Z,2,
Jaskirat Singh,"Thanks mam, this is so helpful😇",2019-06-02T10:01:09Z,3,
Harini md MD,Tq so much for explaining about the course very clearly and it's very useful and make more videos on aids topics...,2022-06-20T07:41:13Z,0,0
Vipin Kumar,can i get the PDF documents about AI and machine learning,2022-06-10T07:01:00Z,0,1
edureka!,Hi great to hear from you :) please share your mail id ! so that we can share the data sheet with you :)Do subscribe the channel for more updates : ),2022-06-10T18:46:36Z,0,
harshal soni,great job edureka....can i have the dataset you used... it will really help,2022-06-06T05:17:32Z,0,1
edureka!,Thanks for showing interest in Edureka! Kindly share your mail id for us to share the datasheet/ source code  :) Do subscribe for more videos & updates,2022-06-06T13:41:32Z,1,
Gaurav Singh,please make this video in Hindi also,2022-06-05T19:57:15Z,1,0
NAUSHEEN MALIK,Thank you so much ma'am. Very nice explaination. Easy to understand. You made all the concepts very clear.,2022-06-03T06:19:40Z,0,1
edureka!,Glad to hear that :) Keep Watching :),2022-06-03T13:19:19Z,0,
Sarang,complete course of artificial intelligence in hindi and english #visionlok,2022-05-25T06:29:54Z,0,0
Ayaskanta Mishra,Best 5 hours spent for a quick grassp on fundamentals of AI & ML. Much recommended for begineers. Well structured crash course and very good instructor.,2022-05-23T09:59:11Z,0,1
edureka!,We are super happy that Edureka is helping you learn better. Your support means a lot to us and it motivated us to create even better learning content and courses experience for you . Do subscribe the channel for more updates : ) Hit the bell icon to never miss an update from our channel : ),2022-05-23T19:44:16Z,0,
LEANN SPINKS,nice,2022-05-13T04:54:35Z,1,0
Henni A,This is a genuinely nice course; is it possible to get PPTs?,2022-04-30T05:10:49Z,0,1
edureka!,Hi please share your mail id to share the data sheet :) We'll Update you soon ! Do Subscribe the channel to keep updated,2022-04-30T18:46:40Z,0,
Victor Giustini Pérez,Great video! I learned a lot! The demos were more complicated to understand because I only have small a python knowledge but I still managed to follow along :)  Thank you!,2022-04-25T08:49:47Z,0,1
edureka!,Thank you so much : ) We are glad to be a part of your learning journey. Do subscribe the channel for more updates : ) Hit the bell icon to never miss an update from our channel : ),2022-04-25T19:46:15Z,0,
Poshala Keerthi Priya,Is there any video related to AI with robotics?,2022-04-21T03:47:15Z,0,1
edureka!,Thanks for showing interest in Edureka kindly visit the channel for more videos our content creators are eagerly waiting for your suggestion to make new videos on your interest :) DO subscribe for the video update,2022-04-21T19:30:59Z,0,
Ankan Deria,"Thanks Edureka for this amazing AI course. This is best AI course ever😍
Can you please share the ppt??
Thank you",2022-04-16T06:40:06Z,0,1
edureka!,Thanks for showing interest in Edureka! Kindly share your mail id for us to share the datasheet/ source code  :) Do subscribe for more videos & updates,2022-04-16T10:36:24Z,0,
shashi A,superb!,2022-04-14T07:16:09Z,1,0
Mehwish Akram,This video has my heart❤. Literally explained everything so clearly. Thanks for making such content.,2022-04-11T12:38:01Z,1,1
edureka!,Hey:) Thank you so much for your sweet words :) Really means a lot ! Glad to know that our content/courses is making you learn better :) Our team is striving hard to give the best content. Keep learning with us -Team Edureka :) Don't forget to like the video and share it with maximum people:) Do subscribe the channel:),2022-04-11T21:01:56Z,0,
Udhaya Kumar,This video's enough for AI concept,2022-04-11T06:37:46Z,0,1
edureka!,Thank you for you time in giving a feedback :) We are glad that  you are learning from our videos! Stay connected with our channel :),2022-04-11T21:27:55Z,0,
Nakky Travels,Great,2022-04-09T06:35:32Z,1,0
MUHAMMAD FAIQ,Best ever AI course,2022-03-09T09:27:04Z,3,0
Chirag Jain,Hi Can You Please Provide The Slides Used Throughout The Video For Refrence And Revision Please It Would Be A Great Help...,2022-03-07T17:08:00Z,1,1
edureka!,Hi great to hear from you :) please share your mail id ! so that we can share the data sheet with you :)Do subscribe the channel for more updates : ),2022-03-07T17:52:34Z,0,
Zainab Farooq,can we please get the source codes of these algorithms?,2022-02-27T09:07:46Z,0,1
edureka!,Good to know your learning with edureka :)  please share your mail id to share the data sheet! We'll Update you soon !,2022-02-27T18:19:35Z,0,
Harshit Raj,"I'm really thankful to Eureka for making me understand basics of AI.
Can I please get all the python codes and CSV files for learning of this video 
Thanks ❤️",2022-02-17T12:32:21Z,0,1
edureka!,Thanks for showing interest in edureka! Kindly share your mail id for us to share the datasheet/ source code  :) Do subscribe for more videos & updates,2022-02-17T17:14:39Z,0,
Yaseen Khamosh,in your examples you use a CSV test file where can I get that??!!1!,2022-02-15T00:45:27Z,0,1
edureka!,Hi great to hear from you :) please share your mail id ! so that we can share the data sheet with you :)Do subscribe the channel for more updates : ),2022-02-16T20:02:12Z,1,
Nenad Jevtic,Excellent course! Is there a link to the python code from the demo examples?,2022-02-11T14:12:10Z,0,1
edureka!,Glad to hear our contents are helping you ! Please provide your mail id to share the data sheet :) We’ll update you soon,2022-02-11T16:43:36Z,0,
Magic in hand,just wowwww i am master student of science but it made things clear and i am really grateful to u,2022-02-09T14:06:08Z,0,1
edureka!,You're welcome 😊 Stay connected with our channel and team :) . Do subscribe the channel for more updates : ) Hit the bell icon to never miss an update from our channel : ),2022-02-09T17:03:52Z,0,
Jonathan Eban,great video well explained. The masters program talked about at the end of this video still going on?,2022-02-09T11:18:29Z,0,1
edureka!,"Hi Jonathan :)
Glad to know our video are helping you understand the concept very much . We do have master program in machine learning now .
Do check the link for more update on the course :https://bit.ly/2WbPMn6",2022-02-09T12:28:26Z,0,
Janith Induwara,Great content you had just prepared. Because it made me feel live about what I am gonna learn and built a curiosity within me! Thank you very much! Looking forward for you to create more content like this ~,2022-02-08T09:06:22Z,0,1
edureka!,You're welcome 😊 Stay connected with our channel and team :) . Do subscribe the channel for more updates : ) Hit the bell icon to never miss an update from our channel : ),2022-02-09T17:56:46Z,0,
Vivek Pawar,can we use reinforcement learning in regression problems?,2022-02-06T17:33:28Z,1,0
tesss_tequila💙,The fact that am learning this for free is actually amazing,2022-02-04T10:05:10Z,1,1
edureka!,Good To know our videos are helping you learn better  :) Stay connected with us and keep learning ! Do subscribe the channel for more updates : ),2022-02-04T18:06:48Z,0,
Jack nickels,🔥🔥🔥,2022-01-31T14:34:43Z,1,0
chim minkook,Could  you pls give me the calculating  steps of weighted avg and calculating IG of child node (road type)?,2022-01-29T10:25:08Z,1,0
thalaivan,"Oh my god u guys are making contents
Free for moneyless people  u r making their dream to come true... Hats off to you guys...",2022-01-27T17:11:02Z,0,1
edureka!,Hey:) Thank you so much for your sweet words :) Really means a lot ! Glad to know that our content/courses is making you learn better :) Our team is striving hard to give the best content. Keep learning with us -Team Edureka :) Don't forget to like the video and share it with maximum people:) Do subscribe the channel:),2022-01-27T19:02:31Z,0,
Solva,"This is a good video indeed.
Am particularly impressed by the animation part.
I wish I could know how to make illustrative videos like such.",2022-01-27T11:12:26Z,0,1
edureka!,Good To know our videos are helping you learn better  :) Stay connected with us and keep learning ! Do subscribe the channel for more updates : ),2022-01-27T15:56:27Z,0,
Ashvin Goorappa,The best online course on AI for beginners,2022-01-26T18:44:52Z,0,1
edureka!,You're welcome 😊 Stay connected with our channel and team :) . Do subscribe the channel for more updates : ) Hit the bell icon to never miss an update from our channel : ),2022-01-27T16:42:35Z,0,
Nick Hao,"Can you share the slides, Python codes and CSV files Via Email? Thanks. and how can I send you my email, I can not text my email here, because youtube will delete the comment with email",2022-01-24T10:50:32Z,0,2
Nick Hao,"I sent, did you get me? I think youtube always delete my email, how can I send to you1?Thanks",2022-01-25T10:54:47Z,0,
edureka!,ood to know our contents and videos are helping you learn better . We are glad to have you with us ! Please share your mail id to send the data sheets to help you learn better :) Do subscribe the channel for more updates : ) Hit the bell icon to never miss an update from our channel : ),2022-01-24T17:34:09Z,0,
Mohamad Alansari,"Can you share the slides, Python codes and CSV files Via Email?",2022-01-20T09:43:01Z,0,1
edureka!,Glad to hear our contents are helping you ! Please provide your mail id to share the data sheet :) We’ll update you soon,2022-01-20T17:23:00Z,1,
Pooja Ajithan,Can you please share the notes and python codes? IDK my previous comment was deleted,2022-01-19T06:52:50Z,1,1
edureka!,Good to know your learning with edureka :)  please share your mail id to share the data sheet! We'll Update you soon !,2022-01-19T18:16:19Z,0,
Electronics with Madhan,"Sir I have one doubt, since unsupervised learning uses patterns to group the input data, that means whether they uses image recognition process? If yes means then it will become a slow process because we are using lot of images, then how it will be possible?",2022-01-17T15:23:39Z,1,0
Cheikh DIOUF,good job,2022-01-11T15:27:26Z,2,0
Kushal,"can I get that python codes ,so I can run in my system and understand it more clearly",2022-01-09T14:04:40Z,0,1
edureka!,Hi great to hear from you :) please share your mail id ! so that we can share the data sheet with you :)Do subscribe the channel for more updates : ),2022-01-09T16:04:28Z,0,
Rukshana Khatoon,Thank you soo much for such an informative video.. I loved it.. Thank you to whole team. ❤,2022-01-02T11:10:06Z,2,1
edureka!,Good To know our vedios are helping you learn better  :) Stay connected with us and keep learning ! Do subscribe the channel for more updates : ),2022-01-02T17:35:27Z,1,
rahil ahmed,Keep it up edureka!,2021-12-23T18:20:05Z,1,1
edureka!,Thank you for your review : ) We are glad that you found our videos /contents useful . We are also trying our best to further fulfill your requirements and enhance your expirence :) Do subscribe the channel for more updates : ) Hit the bell icon to never miss an update from our channel : ),2021-12-24T05:37:15Z,1,
peaches,Pdf of this lecture????,2021-12-21T11:00:02Z,0,1
edureka!,"Hey there :) We are glad to have you with us :) and more glad to have learners like you with us ! We are happy to share the source code ,please do drop your mail id to share the same :) Thank You for being a part of our  Edureka  team : ) Do subscribe the channel for more updates : ) Hit the bell icon to never miss an update from our channel : )",2021-12-23T12:28:05Z,0,
Soumya Chourasia,superb,2021-12-20T04:43:50Z,0,0
Righteous Ness,Excellent teaching. This was my first time learning AI and was relatively easy to understand the main concepts.,2021-12-20T04:16:10Z,2,1
edureka!,Hey:) Thank you so much for your sweet words :) Really means a lot  ! Glad to know that our content/courses is making you learn better :) Our team is striving hard to give the best content. Keep learning with us -Team Edureka :) Don't forget to like the video and share it with maximum people:) Do subscribe the channel:),2021-12-23T13:16:42Z,2,
Ayshath Thasmiya,Do edureka have an advanced course on ai in YouTube?,2021-12-19T19:38:47Z,0,1
edureka!,"Hi :) We do offer a advance courses on AI .Do check the link shared with you for more information . https://www.edureka.co/artificial-intelligence-certification-courses 
Hope this helps :)",2021-12-23T13:11:58Z,1,
Ritik Mangal(IIIT KOTA),Can you provide  pdf of these slides,2021-12-13T14:55:39Z,0,1
edureka!,Hey there :)Thank you so much : ) We are glad to be a part of your learning journey. Definitely ! We are glad to have learners like you .Drop your mail id in the comment section for us to share the data sheets or source codes :) Do subscribe our channel and hit that bell icon to never miss an video from our channel .,2021-12-14T10:29:26Z,0,
Mark,Thanks for the video!,2021-12-13T10:05:32Z,0,0
Ankita's Tech Tutorials,Perfect,2021-12-10T04:02:40Z,1,0
Minhaz Uddin,I like the greeting; Zuleka from Edureka.,2021-12-02T22:09:16Z,1,0
Edwin van Tricht,"Not a programmer myself, but learned a lot! If I could receive the presentation and code that would be great!",2021-11-22T18:34:13Z,0,1
edureka!,Good to know our contents and videos are helping you learn better . We are glad to have you with us ! Please share your mail id to send the data sheets to help you learn better :) Do subscribe the channel for more updates : ) Hit the bell icon to never miss an update from our channel : ),2021-11-23T10:21:18Z,0,
I m Sangamesh,Thanks so much ma'am it was very good and most informational video ❤️❤️❤️❤️❤️❤️❤️❤️❤️❤️❤️❤️❤️❤️❤️❤️❤️❤️❤️❤️❤️❤️❤️❤️❤️❤️❤️❤️❤️❤️❤️❤️❤️❤️,2021-11-18T13:35:25Z,0,1
edureka!,Thank you for your review : ) We are glad that you found our videos /contents useful . We are also trying our best to further fulfill your requirements and enhance your expirence :) Do subscribe the channel for more updates : ) Hit the bell icon to never miss an update from our channel : ),2021-11-19T13:36:20Z,1,
wenyang Yao,could i get the codes in python in the lecture?,2021-11-11T13:52:15Z,0,1
edureka!,Good to know our contents and videos are helping you learn better . We are glad to have you with us ! Please share your mail id to send the data sheets to help you learn better :) Do subscribe the channel for more updates : ) Hit the bell icon to never miss an update from our channel : ),2021-11-18T12:42:27Z,0,
Nilesh Panchal,It was really good Tutorial. Explained in a very nice and simple way. Thanks a lot..,2021-11-11T11:38:31Z,1,1
edureka!,Good To know our videos are helping you learn better  :) Stay connected with us and keep learning ! Do subscribe the channel for more updates : ),2022-01-09T17:29:53Z,0,
Amitanandan ojha,hi i have a question that while u are giving demo which software did u use is it vs code?🤔,2021-11-07T08:43:25Z,0,0
Sakthivel,Madam full artificial course are complete this video,2021-10-31T17:46:59Z,0,0
Abaan Ahmed,Best AI course ever!!!!!!,2021-10-28T16:56:47Z,0,1
edureka!,"Thank you so much for the review ,we appreciate your efforts : )  We are glad that you have enjoyed your learning experience with us .Thank You for being a part of our  Edureka  team : ) Do subscribe the channel for more updates : ) Hit the bell icon to never miss an update from our channel : )",2021-10-29T05:45:55Z,0,
Anmol Basaiwal,"3:26:35, ""this is 1 coma 4 and this is 1 coma 5"". the -1 between them is 1 coma 4.5",2021-10-28T09:13:52Z,2,0
Abu Talib,Very good content indeed!!,2021-10-21T09:10:06Z,0,1
edureka!,Thank you for your review : ) We are glad that you found our videos /contents useful . We are also trying our best to further fulfill your requirements and enhance your expirence :) Do subscribe the channel for more updates : ) Hit the bell icon to never miss an update from our channel : ),2021-10-21T10:33:05Z,0,
Amit Singh,Please provide us PDF link so that we can revise it.,2021-10-20T04:08:49Z,0,1
edureka!,We are happy that Edureka is helping you learn better ! We are happy to have learners like you :) Please share your mail id to share the data sheets :) Do subscribe the channel for more updates : ) Hit the bell icon to never miss an update from our channel : ),2021-10-20T06:42:18Z,1,
Amit Singh,Thank you so much for providing this course. ♥️ I want to download the pdf so that I can revise it by myself whenever i want. Please provide.me link of this pdf so that I can download.it.,2021-10-20T04:03:15Z,0,1
edureka!,Hey there :)Thank you so much : ) We are glad to be a part of your learning journey. Definitely ! We are glad to have learners like you .Drop your mail id in the comment section for us to share the data sheets or source codes :) Do subscribe our channel and hit that bell icon to never miss an video from our channel .,2021-10-20T10:15:06Z,1,
siva,*Nice presentation🙏🙏*,2021-10-17T02:27:31Z,0,2
siva,@edureka! how can I take a course in edureka,2021-10-18T11:38:15Z,0,
edureka!,Thank you for your review : ) We are glad that you found our videos /contents useful . We are also trying our best to further fulfill your requirements and enhance your expirence :) Do subscribe the channel for more updates : ) Hit the bell icon to never miss an update from our channel : ),2021-10-18T11:28:45Z,0,
GAMING VIBES,Please provide us PDF,2021-10-16T05:53:20Z,1,1
edureka!,"Hey there :) We are glad to have you with us :) and more glad to have learners like you with us ! We are happy to share the source code ,please do drop your mail id to share the same :) Thank You for being a part of our  Edureka  team : ) Do subscribe the channel for more updates : ) Hit the bell icon to never miss an update from our channel : )",2021-10-18T13:00:53Z,0,
Krishna Kumar,Hi..pls share course cost details of AI,2021-10-15T11:46:27Z,0,1
edureka!,"Hey Krishna:) We have many courses on artificial intelligence :) 
Do visit our website : www.edureka.co 
Hope this helps:)",2021-10-19T10:13:53Z,0,
Amit Rao,"appreciate the content, the only suggestion if you can explain the notation and terms in the beginning of the video so can be understood at the right place. Thanks for valuable videos.",2021-10-14T06:02:19Z,0,1
edureka!,Hey:) Thank you so much for your sweet words :) Really means a lot  ! Glad to know that our content/courses is making you learn better :) Our team is striving hard to give the best content.We'll consider your insightful review and work on it :)  Keep learning with us -Team Edureka :) Don't forget to like the video and share it with maximum people:) Do subscribe the channel:),2021-10-14T12:39:21Z,0,
Mohammad Anis,"Thanks to the power dear authority. You are doing a philanthropic work. These courses are huge paid. But you are providing with great presentation. Though I am a student of class 9, I love to watch. May Allah endow you all with great success . also pray for my bright future",2021-10-06T07:50:59Z,0,1
edureka!,We are glad to be a part of your journey in this field ! Great to hear that our contents are making an better impact on your learning journey :) Thank You for being a part of our  Edureka  team : ) .Stay connected with our channel and team :) Don't forget to like the video and share it with maximum people:) Do subscribe the channel:),2021-10-06T08:06:19Z,1,
Nikhill Umesh,can anyone learn AI without python ?,2021-10-05T13:20:34Z,0,0
anonymous,"I want to thank specially to mam , ur clarity of speaking , teaching is the best 👍💯 , ur presentation was great and thanks to edureka team to give such video or guidance for free on ai or machine learning.",2021-09-28T17:49:43Z,4,1
edureka!,Great to see that our videos and contents are making you perform better and understand better :) We are glad that you've enjoyed your learning experience with us .Thank you for being a part of Edureka's team:) Do subscribe the channel for more updates : ) Hit the bell icon to never miss an update from our channel : ),2021-09-29T05:21:41Z,1,
Nitin,m likings all the CMT,2021-09-15T20:48:29Z,1,0
Ritu Srivastava,Great efforts! Totally worth it having this tutorial as a beginner.,2021-09-14T10:10:57Z,4,1
edureka!,Hi : ) We really are glad to hear this ! Truly feels good that our team is delivering and making your learning easier :) Keep learning with us .Stay connected with our channel and team :) . Do subscribe the channel for more updates : ) Hit the bell icon to never miss an update from our channel : ),2021-09-28T05:39:58Z,3,
Simran,You explain each and every topic in well manner way through animation. It is very interesting and fun to learn. Can you please provide the summary or details explanation of all the topics shown in video through a website or link . Which can be beneficial for us to future reference or revision.,2021-09-07T16:02:30Z,11,0
Sahil Choudhary,This is so far the most easy & basic way to learn AI. You did woke up my interest in AI.,2021-09-06T09:21:15Z,1,1
edureka!,"Thank you so much for the review ,we appreciate your efforts : )  We are glad that you have enjoyed your learning experience with us .Thank You for being a part of our  Edureka  team : ) Do subscribe the channel for more updates : ) Hit the bell icon to never miss an update from our channel : )",2021-09-06T09:34:22Z,0,
Keerthi N,"Fantastic channel than any other one.... trust me u can learn every small thing clearly in every video.... I'm soooo happy 😀🤟 thanks a lot edureka.... Keep going
 wonderful job❤️",2021-08-23T15:46:05Z,1,1
edureka!,Hey:) Thank you so much for your sweet words :) Really means a lot  ! Glad to know that our content/courses is making you learn better :) Our team is striving hard to give the best content. Keep learning with us -Team Edureka :) Don't forget to like the video and share it with maximum people:) Do subscribe the channel:),2021-08-26T04:47:16Z,1,
injoy inmyself,"Great video 👍👁💚🤲
Using A.I for netflix and youtube recommendations, creates a feedback loop, which releases endorphins, this is the design for a user input digital drug.👁",2021-08-21T14:36:45Z,1,0
Kangan Agarwal,This video is good even for learning machine learning 👍,2021-08-10T22:06:56Z,0,1
edureka!,Thank you for your review : ) We are glad that you found our videos /contents useful . We are also trying our best to further fullqfill your requirements and enhance your expirence :) Do subscribe the channel for more updates : ) Hit the bell icon to never miss an update from our channel : ),2021-08-12T08:34:09Z,0,
Ali Mobedi,Finally finished it! It was great. But definitely took me more than 4.75 hours 😂✌️ thank you!,2021-08-09T02:48:50Z,9,0
Halima Ghannoum,hey can you please share the ppt with us,2021-08-03T20:58:24Z,0,1
edureka!,We are happy that Edureka is helping you learn better ! We are happy to have learners like you :) Please share your mail id to share the data sheets :) Do subscribe the channel for more updates : ) Hit the bell icon to never miss an update from our channel : ),2021-08-06T11:27:06Z,0,
Halima Ghannoum,Best AI video ever!!Thank you so much,2021-08-02T17:53:43Z,0,1
edureka!,Thank you so much : ) We are glad to be  a part of your  learning  journey. Do subscribe the channel for more updates : ) Hit the bell icon to never miss an update from our channel : ),2021-08-03T10:24:35Z,0,
Misbah Kanwal BCS-19-248,"Can you please provide me the Slides of the AI, that you have been discussed in this video. It's really helpful for me but I have spent a lot of time making notes of slides. So kindly provide the notes if possible.",2021-08-02T12:41:20Z,0,1
