Name,Comment,Time,Likes,Reply Count
edureka!,"Hey there :) We are glad to have you with us :) and more glad to have learners like you with us ! We are happy to share the source code ,please do drop your mail id to share the same :) Thank You for being a part of our  Edureka  team : ) Do subscribe the channel for more updates : ) Hit the bell icon to never miss an update from our channel : )",2021-08-03T10:56:05Z,0,
Ashwini palkar,Very good course👍🙂,2021-07-28T08:41:52Z,0,1
edureka!,Thank you so  much  for your review on our channel  Great to hear that Edureka is helping you learn better . We’ll strive to make even better learning contents/courses  in the future ! Do subscribe the channel for more updates  : ),2021-07-28T12:12:14Z,0,
Kankan jyoti Nath,This channel really depicts how education is basically for free.You just need the heart to learn it.,2021-07-06T13:09:56Z,2,1
edureka!,Hey:) Thank you so much for your sweet words :) Really means a lot  ! Glad to know that our content/courses is making you learn better :) Our team is striving hard to give the best content. Keep learning with us -Team Edureka :) Don't forget to like the video and share it with maximum people:) Do subscribe the channel:),2021-07-09T10:36:01Z,1,
universal_motive,Best teachings ever..... i have come across many videos regarding AI  but this is the best ... thank u so much  edureka...,2021-06-29T13:56:40Z,0,1
edureka!,We are super happy that Edureka is helping you learn better. Your support means a lot to us and it motivated us to create even better learning content and courses experience for you . Do subscribe the channel for more updates : ) Hit the bell icon to never miss an update from our channel : ),2021-06-30T06:19:54Z,1,
Muhammad Afif Hidayat,How can I find the datasets?,2021-06-24T01:48:31Z,0,1
edureka!,Hey there :)Thank you so much : ) We are glad to be a part of your learning journey. Definitely ! We are glad to have learners like you .Drop your mail id in the comment section for us to share the data sheets or source codes :) Do subscribe our channel and hit that bell icon to never miss an video from our channel,2021-06-24T05:02:21Z,0,
Sadia Farzana,best 5 hrs i spend on this topic the teacher is amazing,2021-06-24T01:35:10Z,0,1
edureka!,Thank you so much  for your review on our channel  Great to hear that Edureka is helping you learn better . We’ll strive to make even better learning contents/courses  in the future ! Do subscribe the channel for more updates : ),2021-06-25T12:16:04Z,0,
SIVARAMAKRISHNAN M 19EE022,"Can anyone tell me where to get the dataset  please...
if you have kindly sent to arunaakash39@gmail.com",2021-06-17T00:47:44Z,1,0
Ramya Tanuja,Can you provide code for this session,2021-06-11T06:03:34Z,0,1
edureka!,Please share your mail id for to send you the files :) Stay connected with us through youtube channel by subscribing the channel :) Cheers !,2021-06-11T11:53:32Z,0,
Nishant Singh,Lecture is amazing with wonderful animations can you please provide notes,2021-06-08T09:44:04Z,1,1
edureka!,Glad you liked it  ! We are glad to have learners like you Glad you liked it  ! We are glad to have learners like you .Drop your mail id in the comment section for us to share the data sheets or source codes :) Do subscribe our channel and hit that bell icon to never miss an video from our channel .,2021-06-08T10:24:49Z,0,
Aayu,Super amazing video thankyou mam u explained it very well.,2021-05-28T04:44:15Z,0,1
edureka!,Happy to hear that!We are glad to have learners like you . Do subscribe our channel and hit that bell icon to never miss an video from our channel .,2021-05-28T05:58:21Z,0,
Boy,Provide a PDF of video in the description it will be helpful for revision,2021-05-28T03:25:16Z,0,1
edureka!,Hi there !Glad you liked it  ! We are glad to have learners like you .Drop your mail id in the comment section for us to share the data sheets or source codes :) Do subscribe our channel and hit that bell icon to never miss an video from our channel .,2021-05-28T04:52:07Z,0,
AJITH PALATHINKAL,"Excellent, excellent, excellent.....",2021-05-27T04:08:16Z,0,1
edureka!,Many thanks!Glad you liked it  ! We are glad to have learners like you . Do subscribe our channel and hit that bell icon to never miss an video from our channel .,2021-05-27T04:37:51Z,1,
Christen Spremulli,wow im amazed,2021-05-25T04:41:20Z,0,1
edureka!,Thank you for the compliment !Glad our channel is helping you .  Do subscribe our channel and hit that bell icon to never miss an video from our channel .,2021-05-25T05:02:16Z,0,
TK-techy,thanks the way u all explained made this feild an interesting and made an eagerness to learn more. i am wqaiting for next content too.,2021-05-21T06:44:42Z,1,1
edureka!,Thank you for the compliment !Glad our channel is helping you .  Do subscribe our channel and hit that bell icon to never miss an video from our channel :) Keep watching,2021-05-21T08:01:20Z,0,
Akula Kranthi,narration is too good easy to understand,2021-05-15T11:40:39Z,1,0
Ajay Deo,Could you please share the all python code related to ML.,2021-03-11T09:52:54Z,0,1
edureka!,"Hi Ajay, kindly drop in your email id to help us assist you with the required source codes. Cheers :)",2021-03-11T14:47:05Z,1,
Jasleen kaur,Thanku for explaining the artificial intelligence full course with depth and in an easy way... Tomorrow is my AI finals for class 9..This is just Superb to learn from this and i did have cleared all my doubts from this video.. Once again thanku❤,2021-03-09T12:30:03Z,5,0
Minna Rizig,This one of the best tutorials thank you so much for your incredible efforts,2021-03-09T10:47:35Z,4,0
MD ZIAUR RAHMAN,i cant believe i am learning it for free .,2021-03-09T10:05:28Z,1,0
Jon Santos,AI Course (uses PyCharm),2021-03-09T05:32:55Z,0,0
Pari Kumari,😮👍🏻👌🏼🙂,2021-03-06T16:04:52Z,0,0
Girish Chandnani,This video is so well done. I cant say enough about the instructor's depth and approach to the topic. Good job team Edureka!,2021-03-04T18:56:53Z,20,0
Robyn Verma,Thnks endureka,2021-03-02T03:19:54Z,1,0
Robyn Verma,Sir what is difference between this 5hours course and the  the other course with videos,2021-03-02T03:19:08Z,0,1
edureka!,"Hi Robyn, this Artificial Intelligence Full Course tutorial provides a complete and structured understanding of the certification course we offer. On the brightside, do check out our certification courses : https://bit.ly/3mi9kOU and also avail exclusive discounts using the code ""YOUTUBE20"". Cheers :)",2021-03-02T07:59:08Z,1,
Gurudath Gaddad,I just started listening today. You have explained the concept very elegantly. Thank you. Truly inspiring.,2021-03-02T02:16:14Z,5,0
Chitransh gaur,Will it be helpful for btech 1st year,2021-02-26T14:51:40Z,0,1
edureka!,"Hi Chitransh, yes. the following Artificial Intelligence tutorial will definitely be helpful to provide structured insights. Happy learning :)",2021-02-26T15:16:57Z,0,
Palash Prosenjit Malakar,Thank you julekha for sharing this type of high quality tutorials.,2021-02-26T06:20:05Z,2,0
Purple~Rain,Very well explained...the best I've heard so far!,2021-02-26T03:23:14Z,1,0
KAMESH YUVRAJ,the way instructor says is ultimate and great teaching with perfect clear cut voice  thanks a lottttt madam,2021-02-21T18:26:11Z,1,0
DIVYA YADAV,Thanks a lot. Please provide PDF of this.,2021-02-21T02:14:18Z,1,1
edureka!,"Hi Divya, we are glad to help you learn better. However, we do not provide any PDF files from the tutorial. But, you can follow the link: http://bit.ly/3sgaaOG to our reference presentation. Happy learning :)",2021-02-22T09:22:11Z,0,
Nagarjuna pillutla,Leka from edureka nice video,2021-02-17T07:18:41Z,0,0
Madhusudan Rao,Great content presentation!! And a great voice.,2021-02-15T11:46:50Z,4,0
Shailesh Jain,"Excellent video !!! Very well explained , just the right amount of details and information to digest the concepts. Excellent !!! job by the tutor.",2021-02-12T21:56:35Z,9,0
Sobhu Swami 🕉️MAHAKAAL🕉️,Artificial intelligence will be big reason of unemployment,2021-02-11T14:48:19Z,0,0
Ginni Deepak Reddy,Could you Plz... upload in telugu language,2021-02-08T09:42:23Z,0,1
edureka!,"Hi Deepak, we have considered your request and our team will soon come up with the Artificial Intelligence tutorial in our Edureka Telugu Channel. On the brightside, do subscribe: http://bit.ly/3rBLek8 to our channel and stay tuned. Cheers :)",2021-02-09T08:53:18Z,0,
Harshdeep Telang,THis content is free? no its invaluable!,2021-02-07T18:16:40Z,1,0
SE musical studio,Thank you for teacing,2021-02-07T09:59:44Z,1,0
shanu qureshi,Zero to hero tutorial 👌👌,2021-02-06T15:29:07Z,2,0
Enock Oloo,Awesome tutorials Edureka,2021-02-05T16:51:05Z,1,0
Sarthak Jain,you made it soo easy  :),2021-02-02T14:07:37Z,2,0
Henrique C Shiroma,"Very good training, I made many and I am refreshing the theme, this is cristal clear congratulaitions!",2021-02-01T11:51:23Z,3,0
Malik Jalal Ud Din,"'Nano Artificial intelligence is a robotic brain    like humans answering questioning repairing itself & putting that robotic brain in each & every field industry sciences  freeing humans from work & diseases towards achieving immortality'
                         Malik G Jalaluddin",2021-01-29T12:52:32Z,0,0
Ragu S,It is a very good course. Good explanation! Keep up the good work!,2021-01-28T12:29:27Z,5,0
Narain karthic.N.S,"Now I understand why this channel has so many
 subscribers",2021-01-27T14:52:13Z,6,0
manjirit,"This instructor is awesome. Really does a good job of explaining the concepts. The language, the delivery of the speech - everything makes it an interesting video to watch, along the with the content itself. Very high quality tutuorial",2021-01-26T17:06:58Z,8,0
The Work Ethic,"How much time will it take if i dedicate 2hrs daily with concentration to learn it completely till advanced level if there is  any ?

I am very passionate about this and specially in neural networks .

Please tell me ? I am currently in class 9th but i have completed class 9 and 10 th maths and science completely.
Currently i am studying Physics and Maths of  class-11 th.
I am really interested in learning Artificial Intelligence.
Please tell me where to start learning ? 
Is it necessary to complete 11th and 12th maths for learning AI ? Please tell me this  question is stopping me from learning ? I have learned Python .",2021-01-26T10:31:24Z,0,1
edureka!,"Hi, we admire your passion. There is no definite allotment of time taken to gain expertise of Artificial Intelligence. As you are currently in your schooling, we would suggest you to gain all the necessary basics with simultaneously focusing on your core subjects such as math and science. All the best :)",2021-02-09T15:16:30Z,0,
Axel Vanhooren,"Wonderful course. I learned so much with it. Thank you very much !  ""Predicted sentiment: Extremely Positive"" :-D",2021-01-25T22:53:25Z,6,0
hemant jain,Where I can find the code used in this tutorial.,2021-01-25T14:53:40Z,0,1
edureka!,"Hi Hemant, kindly drop in your email id to help us assist you with the required source codes. Cheers :)",2021-01-25T16:24:01Z,0,
Lavi's Recipes,Awesome explanation..,2021-01-22T06:35:02Z,2,0
Ravishankar Subbanna,"nice course.. and good introduction to the AI, ML.  Nice job by the tutor",2021-01-17T02:57:35Z,1,0
MELOPHILE ✨,"Thank you miss, i m just entered in the field of AI and getting more interest as i can understand it well through EDUREKA. 
But most probably questions generated in my mind is is AI got emotions or it became corrupted then I think this will be the beginning of destruction of Human Life.... And mostly it is also mentioned by Stephens Hawkins....",2021-01-16T09:12:17Z,2,0
Vishnu Shankar,Can we get the code of examples used in video ?,2021-01-13T16:18:13Z,0,1
edureka!,"Hi Vishnu, kindly drop in your email id to help us assist you with the required source codes. Cheers :)",2021-01-15T16:55:11Z,1,
Sumaiya Tasnim,"Heartiest gratitude to edureka for sharing such an amazing tutorial! 
Is it permitted to use your tutorials while making a slide presentation for education purposes?",2021-01-13T06:09:54Z,2,1
edureka!,"Hi Sumaiya, you can definitely derive valuable suggestions and inputs from the following tutorial for your study purpose. However, it is always advisable to mention the reference in your presentations. All the best :)",2021-02-09T15:19:06Z,1,
Deepanshu Goyal,"Amazing lecture, thank you for posting such a valuable course over YouTube.",2021-01-12T12:08:06Z,1,0
raju saha,Useful videos .,2021-01-11T01:08:04Z,1,0
Ethan Wang,One note: a large chunk of this course is about knowledge discovery. Machine Learning is a subset of that.,2021-01-10T18:11:44Z,2,0
Matko Pejar,edureka! thank you!,2021-01-07T21:11:28Z,1,0
Rabia Tabassum,give as the powerpoint presention file,2021-01-06T14:36:33Z,0,2
Rabia Tabassum,@edureka!  ok thanks,2021-01-10T14:37:11Z,0,
edureka!,"Hi Rabia, we are sorry as we cannot disclose the presentation used in out tutorial. However, here is the link: http://bit.ly/3rZpnnX to help you in referencing. Also, do checkout: https://bit.ly/3mi9kOU our industry graded Artificial Intelligence Certification Course and avail exclusive discounts using the code ""YOUTUBE20"". Cheers :)",2021-01-08T17:17:00Z,1,
Jagadish Malothu,Mam Can I get full course in online if it is possible means from where can I get it please respond me mam,2021-01-04T15:05:35Z,0,1
edureka!,"Hi Jagadish, our full-fledged certification courses are completely based on online trainings. Kindly follow the link: https://bit.ly/3mi9kOU or reach us on our toll-free number 08035068108 for further assistance. Happy learning :)",2021-01-05T13:30:06Z,0,
Simran S,"My one stop video for kick starting my AI journey! Thanks for the content and creators!. Please share the demo code if possible. Thanks a lot., Awaiting many more videos like this",2021-01-02T11:52:50Z,0,1
edureka!,"Hi Simran, we are glad to keep you boosted with our sessions. On the bright side we do share practise codes to enhance your learning, drop in your email id( it will not be published) and we will share the codes to you. Happy learning :)",2021-01-04T14:04:50Z,0,
Jagadish Malothu,Hi mam I have an dought what is the use of this course,2021-01-02T11:49:05Z,0,1
edureka!,"Hi Jagadish, Artificial Intelligence is branch of Computer Science, wherein Machines are designed to perform human like activities. As, you pursue this course you can enhance your skills and create more programmes. Here is a link: https://bit.ly/355XzV9 to help you gain more insights on Artificial Intelligence. Aslo, do check out our certification course: https://bit.ly/3mi9kOU to get structured and impactful training from the industry experts. Cheers :)",2021-01-04T14:04:11Z,0,
Ahmad Ali,"thanks for helping through that particular platform, and i must say is a tremendous way of teaching... even i am new to this technology but i understand most of its part...",2021-01-02T02:43:05Z,0,0
CRIS7COOP,How many of you watching in 2021? ❤️,2021-01-01T16:05:22Z,1,0
santosh kumar korada,"Hello madam,
I would like to learn the course and able to earn professional experience in this field , but I am mechanical engineer ,b.tech pass out 2014 batch, is there any job assistance from edureka.",2021-01-01T14:45:39Z,0,1
edureka!,"Hi Santosh, you can definitely become an AI based professional and receive job assistance from Edureka. We would like to help you better in choosing the right course. kindly submit your details: https://bit.ly/39ZTtRy and our career counsellors will guide you. Meanwhile, follow the link: https://bit.ly/3mi9kOU to view our certification courses and avail exclusive discounts using the code ""YOUTUBE20"". Cheers :)",2021-01-04T14:03:01Z,0,
Ahmad Ali,really informative,2020-12-31T11:33:04Z,3,0
Rohit Chitte,"Really Good Introductory course on AI  , Can viewers get the code  and ppt described in above video  it will be really helpful !",2020-12-27T10:17:35Z,0,1
edureka!,"Hi Rohit, you will definitely get the source codes. Kindly drop in your email id and we will share it to you. Cheers :)",2020-12-31T15:53:23Z,1,
Limpid Technologies,👍🏻❤️❤️,2020-12-27T05:51:42Z,0,0
saiteja nani,❤❤😊😄😄loved it,2020-12-25T12:12:09Z,0,0
Prasanth G S,I am amazed by the quality of this course. Explaining in a very detailed but simple way. Thank you for doing this. 👍,2020-12-23T00:35:06Z,0,0
Dummy X Gaming,Such a nice explanation. All the concepts were cleared. These things I never understood in my online classes🙂♥,2020-12-22T15:58:17Z,1,0
Keera thoughts,leka from edureka rhymes well,2020-12-16T16:22:51Z,0,0
Cyber Security,Excellent work !!!!,2020-12-16T10:52:53Z,2,0
Akbarjon Abdufattoev,Great video making sense about AI,2020-12-12T18:36:00Z,0,0
Vinay Yadav,Awesome. Video,2020-12-09T15:31:23Z,1,0
تعلم الرسم,hello! can you please put the datasets(fruit_data.txt ....) on the description?? Thank you for your great videos :),2020-12-06T15:10:15Z,0,1
edureka!,"Hi, we do not publish our datasets in the description box, kindly drop in your email id and we will share them to you, cheers :)",2020-12-07T13:53:52Z,0,
eren Yeager,Ultron is best example of A.I,2020-12-05T07:37:45Z,1,0
PoonGundran Selvaprabhu,"Dear mam,  Wonderful  presentation ,, is it possible to get ppt",2020-12-03T08:00:53Z,0,1
edureka!,"Hi, thankyou. Unfortunately, we do not disclose any presentations that are part of the tutorial. Kindly follow the link: https://bit.ly/33AhtGL, to help you in referencing. Hope this is useful, cheers :)",2020-12-03T10:54:37Z,0,
Medhatithi Chattopadhyay,Fantastic,2020-12-02T07:52:30Z,1,0
smitha r,Very well made and explained. Thank you for keeping it for beginners to understand in simple way. Appreciate your effort 👍,2020-12-02T04:33:55Z,5,0
Kalyan V,sampath.kalyan133@gmail.com .I want to enroll machine learning course,2020-12-01T06:44:32Z,0,1
edureka!,"Hi Kalyan, we do provide certification courses on machine learning. Kindly visit: https://bit.ly/37qXIT9 to view the courses or reach us on our toll-free number 08040423752 for more assistance. Also, you can avail exclusive discounts using our coupon code ""YOUTUBE20"" , cheers :)",2020-12-01T15:20:24Z,0,
Rishabh Pathak,"finaly ... A video that really describe what AI actually is ..instead of just introducing about the pacakges and salary..this course also taught about the history, types , and deep understanding in a very systemetic way....

Thank u alot..",2020-11-27T09:38:21Z,6,0
Rudy Komarraju,"Hi Zulaikha, You did an exceptional job of giving a unique intro to AI. I wish I had this info some 20 years ago. It could have changed my life completely",2020-11-26T20:33:50Z,18,0
sircilla venkatesh,Is this a full course? Is it enough to get complete skills in AI?,2020-11-26T14:57:21Z,0,1
edureka!,"Hi Sircilla, the video presentation is an overview of the course that we offer. However, if you are looking for a structural training with detailed insights,  we suggest you to take up a certification course. Kindly visit: https://bit.ly/3mi9kOU to view the various certifications we offer,  also, you can avail exclusive discounts by using the code ""YOUTUBE20"" cheers :)",2020-11-27T16:01:02Z,0,
Dragos Tang,Perfect perfect lecture!   Thank you very much.  Is there anyway we can get the python code in the examples you used in this video?,2020-11-25T22:43:27Z,1,1
edureka!,"Hi, kindly drop in your email id with us and we will assist you with the required source codes :)",2020-11-26T14:06:49Z,0,
Poisson Harsha,An excellent tutorial for beginners madam,2020-11-25T15:05:51Z,1,0
Navdeep Singh,"Thankyou so so much edureka..
Please tell me all the sequence of courses to watch all videos, plz. 💖💖🙏🙏",2020-11-23T15:06:20Z,0,1
edureka!,"Hi Navdeep, here is a link: https://bit.ly/3l1wqYz to the artificial intelligence playlist, hope this fulfills your need. Keep learning with us, cheers :)",2020-11-24T12:49:51Z,0,
sekhar babu,I m medical background person i dont anything about regression means,2020-11-18T10:35:40Z,0,1
edureka!,"Hi Rishi, please find the following link: https://bit.ly/35D1tFA to help you understand the meaning of regression and its types. Hope this will fulfill your basic requirements, cheers :)",2020-11-18T12:21:02Z,0,
Good hope,Excellent.. Very useful session... So thaankssss mam🥰🥰🥰,2020-11-18T01:20:33Z,1,0
Harold R. Bettencourt III,I thought I should learn something new.. this is great I loved it. How easily she made me understand all those complex terms. Hats off mam ! Thanks a lot 😊,2020-11-16T18:10:01Z,6,0
Bharath Kumar,i need datsets sir .where can i get that,2020-11-12T14:01:11Z,0,1
edureka!,"Hi Bharath, kindly drop your email id along with this comment, to help us assist the codes.",2020-11-16T13:06:23Z,0,
Sanjay Mehra(Software developer Trainee),"This video is very good as well as your voice,thanks",2020-11-12T06:46:13Z,0,0
nithin reddy,It's  very good,2020-11-03T10:04:28Z,2,0
FUN Learning,How to share my email for code??,2020-10-20T21:03:13Z,0,1
edureka!,Please share your email id here in the comment section (it will not be published). We will forward the code to your email address.,2020-10-21T05:55:32Z,0,
jc,1:09:15,2020-10-19T06:45:09Z,0,0
McKay Scott Christensen,"AMAZING VIDEO. Thank you so much for your effort putting this together, I feel conversational in AI now.",2020-10-14T22:36:41Z,4,1
edureka!,"Hey Scott, thank you for appreciating our efforts. We are glad you loved the video. Do subscribe and stay tuned for future updates. Cheers!",2020-10-16T05:28:31Z,0,
Srinivas Seenu,Where can i get this full course i want to complete this course any one tell me best institute plss plss i am intrested in it i want to work on ai,2020-10-12T05:30:16Z,0,1
edureka!,"Hi Srinivas, you can check out our online certification training for AI here:
Post Graduate Program in Artificial Intelligence and Machine Learning - https://bit.ly/2YodPOK
The above PG program is offered jointly by Edureka and E&ICT Academy, NIT Warangal.
You can use code ""YOUTUBE20"" and enroll in our courses with Flat 20% off.
For further assistance from our course advisors, please provide us your email ID and contact number (it will not be published).",2020-10-15T07:08:35Z,0,
Talson Hacks,"amazing lecture, informative and comprehensive. thank you so much!",2020-10-12T03:40:55Z,6,1
edureka!,Thanks for the wonderful feedback! Stay tuned for future updates. Cheers!,2020-10-12T07:46:19Z,1,
Rupesh singh,Thanks Edureka!!!!!!!,2020-10-11T07:48:55Z,0,1
edureka!,"You are welcome👍 
Do subscribe to our channel to stay posted on upcoming tutorials: https://www.youtube.com/user/edurekaIN?sub_confirmation=1.",2020-10-12T07:51:17Z,0,
Rupesh singh,Excellent Trainer Excellent contents............,2020-10-11T07:48:22Z,0,1
edureka!,Thanks for the wonderful feedback! Stay tuned for future updates. Cheers!,2020-10-12T07:53:21Z,0,
Flare,"Didn't watch till the end yet, already love the video!!!",2020-10-10T11:45:02Z,0,0
Dhanashri Patil,Nice good course of artificial intelligence,2020-10-09T05:24:57Z,0,0
Rahul Prasad,Intrested in edureka course,2020-10-08T13:30:29Z,0,1
edureka!,"Hi Rahul, you can check out our online certification training here:
Machine Learning Engineer Masters Program - https://bit.ly/3bRGJL2
Post Graduate Program in Artificial Intelligence and Machine Learning - https://bit.ly/2YodPOK
You can use code ""YOUTUBE20"" and enroll in our courses with Flat 20% off.
For further assistance from our course advisors, please provide us your email ID and contact number (it will not be published).",2020-10-09T05:58:44Z,0,
Shweta Mehta,Can a non-engineer learn too ? I have huge experience in handling websites and portals. know things technically. much interested in AI. can i too,2020-10-08T08:21:34Z,0,1
edureka!,"Hi Shweta, there is no eligiblity criteria for this course, however you need to learn programming languages and a lot other concepts. Here's a blog that will make you understand what skills are needed to become an AI engineer: https://www.edureka.co/blog/become-artificial-intelligence-engineer/",2020-10-15T05:59:57Z,1,
Prajwal Kudale,"Hi 
I am unable to fetch the data set used for linear regression. Can I have link regarding the same ?",2020-09-30T08:14:07Z,0,1
edureka!,"Hi Prajwal, please share your email id here in the comment section (it will not be published). We will forward the dataset to your email address.",2020-10-07T09:48:17Z,0,
Nuwan De Zoysa,Thank you for giving me insight to AI. Very valuable lecture for anyone interested in AI.,2020-09-29T13:14:11Z,1,0
NerloGugutochi,"such a well made tutorial
thank you",2020-09-28T09:57:05Z,2,0
Krishna Senthil,How to select the apt value for gamma in reinforcement learning.,2020-09-28T05:17:20Z,0,1
edureka!,"Typically, gamma is viewed as part of the problem, not of the algorithm. A reinforcement learning algorithm tries for each state to optimise the cumulative discounted reward:

r1 + gamma*r2 + gamma^2*r3 + gamma^3*r4 ... 

where rn is the reward received at time step n from the current state. So, for one choice of gamma the algorithm may optimise one thing, and for another choice it will optimise something else.
However, when you have defined a certain high-level goal, there still often remains a modelling choice, as many different gamma's might satisfy the requirements of the goal.

In general, most algorithms learn faster when they don't have to look too far into the future. So, it sometimes helps the performance to set gamma relatively low. A general rule of thumb might be: determine the lowest gamma min_gamma that still satisfies your high-level goal, and then set the gamma to gamma = (min_gamma + 1)/2.

Hope that solves your query.",2020-10-20T11:47:12Z,0,
