Name,Comment,Time,Likes,Reply Count
real gaming spot,"Our school has given three options to us
1) information technology 
2) artificial intelligence 
3) banking and insurance 

That's why I am watching this video that what is AI... i have taken AI",2020-09-26T16:52:20Z,0,0
Somashekar Hiremath,"Awesome...Tutor is very clear, concise and effective in engaging listeners. Thank you",2020-09-20T07:35:50Z,0,0
Yugam Bhatt,1:14:15 leaving a time stamp for myself 😊,2020-09-17T17:17:37Z,12,0
Ramesh kumarddz,beautiful explanation ....superb,2020-09-17T09:09:44Z,0,0
FREDERICK LENIN D,What is the difference between supervised and unsupervised learning?,2020-09-16T15:12:30Z,0,1
edureka!,You can refer to the following video to know the difference between supervised and unsupervised learning - https://www.youtube.com/watch?v=xtOg44r6dsE,2020-10-13T06:58:27Z,0,
Madhu,loved this .. keep going.,2020-09-14T14:33:15Z,1,0
nc b,Good,2020-09-13T13:36:35Z,0,0
Ishwar Kurrey,This is a great learning plateform .l loved this so much.,2020-09-10T09:50:46Z,8,0
K.M. Subbaiah,thanks a lot,2020-09-08T14:58:47Z,0,0
Santokh Dhillon,"This is basic AI course , well explained and easy to understand. Well done",2020-09-08T08:59:17Z,6,0
bharathdaiict11,Excellent Video!!!!!,2020-09-05T15:36:38Z,2,0
P L,Is there a place to get the code in the video?,2020-09-04T18:52:43Z,0,1
edureka!,Please share your email id here in the comment section (it will not be published). We will forward the source code to your email address.,2020-09-07T17:07:36Z,0,
Donny Varghese,Brilliant Video. Thank you Edureka! Thanks to the tutor too!,2020-09-04T17:17:47Z,5,0
Rizz Syed,"Everything is just 'Perfect' in this tutorial, The complete world at a single place. Please keep spreading knowledge, light & wisdom. Excellent to see the great skills, Tutor is having. A long way to go for her as well. This is just a beginning",2020-09-04T16:29:12Z,24,0
gu s,Can you please send me the code files? Thanks a lot!,2020-09-03T08:40:34Z,0,1
edureka!,Please share your email id here in the comment section (it will not be published). We will forward the code to your email address.,2020-09-07T17:08:05Z,0,
MES,gud job!!!!,2020-09-02T11:24:28Z,2,0
K.M. Subbaiah,how to download the dataset,2020-08-31T14:42:09Z,0,1
edureka!,Please share your email id here in the comment section (it will not be published). We will forward the dataset to your email address.,2020-09-07T17:08:23Z,0,
Ishwar Sorapadi,"Tutor explanation about subject, is best of all videos, I have came across so far. I wish to express my heartfelt gratitude and sincere thank to tutor & edureka for making such valuable videos",2020-08-31T13:33:22Z,7,0
Bunny Bird,I love edureka💖,2020-08-30T07:54:20Z,0,0
Rocky X,"Based on Knowledge from the course and NLP skills which I learned from the course , I think teacher name is SAHITI, 

Thanks for teaching.",2020-08-27T07:08:29Z,1,0
kavuturu sowjanya,This was very much intresting and most useful...which helped me a lot when I searched for basic AI ...the explanation  with your examples was soo good for beginners...thankyou edureka...,2020-08-25T12:53:11Z,2,1
edureka!,"You are welcome👍 
Do subscribe to our channel to stay posted on upcoming tutorials: https://www.youtube.com/user/edurekaIN?sub_confirmation=1.",2020-09-07T17:13:51Z,0,
Royten vines,Superb!,2020-08-25T09:26:20Z,0,0
vinay kumar,Hi sahiti ur voice is awesome thanks 4 the informative one,2020-08-25T06:41:25Z,1,0
Anisha Sankhla,"It is the first time that I'm totally focused and completely satisfied by the content on you tube .and it's also much better then the any other online paid sources on AI ,a very good job edureka .",2020-08-23T11:45:48Z,13,0
Samarpita Roy,A very good session. Thank you so much!,2020-08-23T03:47:19Z,0,1
edureka!,"You are welcome👍 
Do subscribe to our channel to stay posted on upcoming tutorials: https://www.youtube.com/user/edurekaIN?sub_confirmation=1.",2020-09-07T17:12:24Z,0,
Swapnil Ghule,Spending my lockdown period in this course is really a Excellent experience of learning with Edureka Thank you !!,2020-08-18T15:47:21Z,12,0
Deepshikha Lalwani,"Actually i want to do this course as my internship and want certificate for the same

Do u provide",2020-08-17T18:24:46Z,0,1
edureka!,"Hi Deepshikha, we provide certificate in our online training. Please find the details here:
AI & Deep Learning with TensorFlow - https://bit.ly/2VaiYax
Post Graduate Program in Artificial Intelligence and Machine Learning - https://bit.ly/2YodPOK
Use code ""YOUTUBE20"" and enroll in our courses with Flat 20% off.",2020-08-26T06:31:41Z,0,
Inspire me and Inspire you,Can u pls. Send notes,2020-08-11T16:17:49Z,0,1
edureka!,"Hi Gopika, you can check out the slides here: 
https://www.slideshare.net/EdurekaIN/what-is-artificial-intelligence-artificial-intelligence-tutorial-for-beginners-edureka
You can also check out our blogs here: https://www.edureka.co/blog/category/artificial-intelligence/
Hope that helps!",2020-09-08T13:30:12Z,0,
ETC_SY_A_12_Venkatesh Madanwale,Please provide the dataset for the practice purpose...,2020-08-11T13:01:50Z,0,1
edureka!,Please share your email id here in the comment section (it will not be published). We will forward the dataset to your email address.,2020-09-07T17:10:57Z,1,
Incog Facts,Although the video is very lengthy i didn't feel bored while listening. Thanks mam for the great explanation skills.  We will support for longer. Thanks,2020-08-09T08:40:18Z,1,0
Incog Facts,Super madam..  great explanation,2020-08-09T08:37:41Z,1,0
Veeranna Kotagi,Great work,2020-08-07T07:13:51Z,0,0
Soyab Ali,Great learning- it has cleared my understanding of AI,2020-08-06T18:07:03Z,3,0
mixme,thank you mam,2020-08-05T00:12:37Z,0,0
Dayeeta Das,I have come across a lot of videos on AI so far. This is definitely the most precise and presentable tutorial. Kudos to the creators for sharing such an amazing work. Thanks a lot.,2020-08-04T20:42:46Z,108,0
Sahil Singh,Thanks mam. I'm am now a student and wanted to know the basics of artificial intelligence.You helped me a lot.,2020-08-03T01:33:14Z,0,0
Kim Deayoung soo,it’s helpfull😇,2020-08-02T16:35:03Z,0,0
Harvinder Arora,Thanks It's a great explained of each topic.,2020-08-02T15:22:48Z,1,0
Kumar Anant,OMG!! I am from non-science background. Yet this video made me feel very comfortable. This video is absolutely must for any fresher like me who wishes to understand AI. Please keep making such videos. Great job Edureka! All the best. 😀,2020-08-02T12:39:37Z,5,0
Yogesh Nangare,This is the best teacher for AI I have ever seen. Thank you so much.,2020-08-01T13:27:59Z,4,0
priya keshker,"I had a subject of artificial intelligence, if I've watched this video before my class I would get more interest in my class ❤❤we performed AI in simulink MATLAB.",2020-07-26T20:22:06Z,0,0
tanveer ali,Pdf file send krdo,2020-07-26T04:55:38Z,0,1
edureka!,"Hi Tanveer, there is no pdf document of the video, but you can refer to our AI blog series here: https://www.edureka.co/blog/what-is-artificial-intelligence",2020-08-08T08:27:24Z,0,
UJwall,So helpful,2020-07-25T09:02:00Z,0,0
Shivani Singh,Your teaching style is amazing and your voice is also clear,2020-07-21T14:49:19Z,1,1
edureka!,Thanks for the compliment! We are glad we could help. Do subscribe to our channel to stay posted on upcoming tutorials.,2020-07-25T07:11:44Z,0,
santhosha bm,your teaching style awesome madam....can we get this ppt?,2020-07-21T06:44:27Z,0,1
edureka!,"Thanks for the compliment! 
You can check out the ppt here: https://www.slideshare.net/EdurekaIN/what-is-artificial-intelligence-artificial-intelligence-tutorial-for-beginners-edureka",2020-07-21T17:43:16Z,1,
ATHUL T LATHAN,"If you could be a university, students would be lucky !!",2020-07-20T20:14:47Z,0,0
Komal Parihar,Where can I possibly find the notes or PPT of this video?,2020-07-20T05:17:13Z,0,1
edureka!,"Hi Komal, you can check out the slides here: 
https://www.slideshare.net/EdurekaIN/what-is-artificial-intelligence-artificial-intelligence-tutorial-for-beginners-edureka
You can also check out our blogs here: https://www.edureka.co/blog/category/artificial-intelligence/
Hope that helps!",2020-07-20T05:38:06Z,0,
Aakash Anbazhagan,Just now i have finished my 12 th std..I am so much interested to take AI course in college...so does it have scope in the future..?what are the subjects incl in this course..?..pls reply..❣️,2020-07-19T14:14:56Z,3,1
edureka!,Here's a blog that will help you get started: https://www.edureka.co/blog/become-artificial-intelligence-engineer/,2020-07-22T11:33:45Z,1,
Bui Chi Tai,Great videos. Thank you for your effort !,2020-07-19T07:46:37Z,0,1
edureka!,"You are welcome👍 
Do subscribe to our channel to stay posted on upcoming tutorials: https://www.youtube.com/user/edurekaIN?sub_confirmation=1.",2020-07-23T18:44:03Z,0,
aisha sultana,I had watched all full video and now it is easy for me to learn AL,2020-07-18T11:52:03Z,1,0
Yasir Ali Khan,I don't comment often. But your style of speech delivery is so impressive that I have to.,2020-07-18T08:03:23Z,21,0
learn2earn,"Thanks a lot and lot to the respectful  EDUREKA! Team members..... Thanks is not sufficient, I hope... Because you are the people (team)making students like us to be as future aspirants in the fields of TECHNOLOGY by giving knowledge a lot... I'm utilizing my valuable time in this quarientine by your vedios by learning the courses that you're providing... Everything in vedios are clear , concise and important ... A student should watch this... I really appreciate you Army ❤️ for your supports in this quarientine to us ...
Thank you ! Keep updating always 😇
Love you edureka! Thank you
😘❤️😊
By Siri BTech first year...!
Thanks for your support...",2020-07-17T13:54:29Z,2,2
learn2earn,"Cheers! Actually, I subscribed and also shared when I had seen the tutorial of python for the first time in your channel and also I did share to my friends and BROTHERS too..... Because I feel sharing is caring as my responsibility... thank you keep forward with update vedios 😊👍",2020-07-24T05:27:12Z,1,
edureka!,"Hi Siri, thanks for the wonderful feedback! We are really glad you feel this way about our channel. Do subscribe to our channel to stay posted on upcoming tutorials. Cheers!",2020-07-23T17:33:27Z,1,
Home Academy Point,"Every second of video is usefull and voice is so clear ,such an important and useful overview on the AI",2020-07-16T02:00:12Z,0,1
edureka!,Thanks for the compliment! We are glad we could help. Do subscribe to our channel to stay posted on upcoming tutorials.,2020-07-17T13:42:38Z,0,
Alkane dust,1:01:45,2020-07-15T08:23:00Z,1,0
Atanu Paul,Truly awesome and helpful for beginners,2020-07-14T20:21:26Z,1,0
Pavan Kumar Goud,awesome....!!!!!,2020-07-13T16:52:56Z,1,0
Rishish anand misra,I really enjoyed  every second of this AI season. Fantastic season.,2020-07-13T07:39:54Z,4,0
Learn with RM !,ai is my only goal,2020-07-12T06:57:14Z,0,0
Chandanita Chatterjee,U r extraordinary  mam,2020-07-10T10:22:25Z,0,1
edureka!,Thanks for the compliment!,2020-07-10T13:45:43Z,0,
R. Vishwanath,thank you so much for your great work:),2020-07-10T05:30:10Z,1,1
edureka!,"You are welcome👍
We are glad we could help. Do subscribe to our channel to stay posted on upcoming tutorials.",2020-07-13T11:15:12Z,1,
Aditya Belenkar,Very good brief introduction and one stop for revision,2020-07-09T18:55:32Z,2,0
Artificial Intelligence,Great content,2020-07-05T17:36:51Z,0,1
edureka!,Thank you.,2020-07-06T10:45:15Z,0,
Rakesh Reddy,3:42:20,2020-07-05T04:54:58Z,0,0
🧡 Nidhi 🧡,Can you plzz give the pdf of AI book,2020-07-05T01:58:25Z,0,1
edureka!,"Hi Nidhi, there is no pdf document of the video, but you can refer to our AI blog series: https://www.edureka.co/blog/what-is-artificial-intelligence",2020-08-08T08:25:20Z,0,
Rakesh Reddy,2:40:44,2020-07-04T13:12:57Z,0,0
Rakesh Reddy,1:38:51 just for myself,2020-07-04T05:21:15Z,0,0
Tejana Raithatha,Very well explained.. thanxs for having lots of patience and taking us through the entire course in simple and clear form,2020-07-01T17:01:40Z,1,1
edureka!,Thanks for the compliment! We are glad we could help. Do subscribe to our channel to stay posted on upcoming tutorials.,2020-07-03T05:31:04Z,2,
Amine Mehablia,Great job.,2020-06-28T01:28:52Z,1,0
Amine Mehablia,Can we have access to the codes?,2020-06-28T01:26:09Z,0,1
edureka!,Please share your email id with us (it will not be published). We will forward the code to your email address.,2020-07-03T07:31:06Z,0,
navir momin,"Subtitles are extremely useful, excellent work.",2020-06-27T05:32:08Z,8,0
Jasi,Superb class,2020-06-27T05:23:00Z,1,0
astha chourey,I thought I should learn something new.. this is great I loved it. How easily she made me understand all those complex terms. Hats off mam ! Thanks a lot 😊,2020-06-24T17:38:53Z,8,0
Cute habesha,great course,2020-06-22T08:06:59Z,0,0
Krish Chary,Great voice,2020-06-21T16:11:27Z,0,0
Arbaj Shaikh,"nice explanation ,very helpful in study",2020-06-18T07:54:52Z,2,0
Datascience Concepts,Great Content! Really helpful.,2020-06-17T16:05:11Z,2,0
Jamal Hussain,2:27:46,2020-06-16T17:37:56Z,1,0
Ray Mond,Thank you very much for your generous knowledge.,2020-06-16T00:17:16Z,1,0
Sunita Singh,I want to make an ai like Jarvis,2020-06-15T11:20:12Z,4,0
Adeoye Feranmi Samuel,Thanks guys. You have really done a great job training people for free.,2020-06-15T09:09:29Z,6,0
Akshit Jain,2:14:55,2020-06-13T08:17:13Z,0,0
Rania Bz,learning from here annd not from the university,2020-06-11T18:12:42Z,0,0
Priya Dhanwate,Superb..The way you explained is outstanding . Now I am more interested in AI n ml saw this video .,2020-06-11T08:34:12Z,10,0
astroboy tech ranger,nice video,2020-06-11T05:08:10Z,0,0
prakul sharma,can i have these codes used in the video?,2020-06-09T04:19:26Z,0,1
edureka!,Please share your email id with us (it will not be published). We will forward the code to your email address.,2020-06-09T11:32:28Z,0,
Logendher Gunasekaran,What is the use of linear regression and why we using linear regression,2020-06-08T02:34:43Z,0,1
edureka!,Linear regression is a regression analysis technique that is used to determine a relationship between two continuous variables in a dataset. For more on linear regression refer this blog: https://www.edureka.co/blog/linear-regression-in-r/,2020-07-01T18:15:45Z,1,
Vigneshwari,I finally satisfied myself by learning a very useful things.... Tnqqq Tnqqq so much mam,2020-06-07T10:26:11Z,1,0
BalaKrishnan R,Excellent presentation and nice flow. Thank you so much for sharing in YouTube.,2020-06-03T08:57:39Z,8,0
Deep the candle,Thanks a lot.,2020-06-03T04:20:38Z,0,0
Saba Chaudhary,Subscribed:-),2020-06-01T10:25:06Z,1,0
Gyanesh Sahu,Thq so much for Artificial intelligence course,2020-05-23T17:47:28Z,1,0
Uday Anand,I want this pdf,2020-05-23T12:02:38Z,0,1
edureka!,"Hi Uday, there is no pdf document of the video, but you can refer to our AI blog series here: https://www.edureka.co/blog/what-is-artificial-intelligence",2020-08-08T08:30:18Z,0,
ravi misra,Where can I get the code?,2020-05-23T09:41:41Z,0,2
ravi misra,@edureka! thanks but seeing your other videos I could make the code on my own. Excellent videos.,2020-05-28T04:21:35Z,0,
edureka!,Please share your email id with us (it will not be published). We will forward the code to your email address.,2020-05-27T19:08:16Z,0,
Ram Amit,Very interesting.,2020-05-22T07:04:01Z,1,0
shreepada G,"Hi , can you please share data set & code used for this training ?",2020-05-15T07:58:25Z,1,1
edureka!,Please share your email id with us (it will not be published). We will forward the code and dataset to your email address.,2020-05-27T19:18:31Z,0,
Khalil Canady,Learning about the future NOW!!!!,2020-05-14T20:35:12Z,0,0
a ogunnaike,"Thanks guys, keep it up. God bless you guys",2020-05-09T22:57:41Z,1,0
Rahil Kothari,"Incredible work by Edureka....The brief explaination for each and every individual topic was really helpful...
Great work guysss......Keep up the good work...Cheers!!!!",2020-05-05T14:52:39Z,5,0
Haridas Patil,Nice explain,2020-05-05T12:39:01Z,0,0
hardik pithadia,"Amazing , got so much clarity on these topics. Will surely help me during my conversations with clients",2020-05-03T15:39:24Z,6,0
vyshnavi sreekumar,nice,2020-05-03T13:39:53Z,0,0
Muamber Khan,"Assallam o alykum MAM... I am having some errors in my code, can you please provide me the dataset you have used in the video.",2020-05-02T12:09:11Z,0,1
edureka!,Please share your email id with us (it will not be published). We will forward the dataset to your email address.,2020-06-15T18:31:54Z,0,
A M,Good presentation,2020-04-23T17:31:58Z,0,0
Mr Azhar,where to download data sets that are being used in this course?,2020-04-22T08:09:03Z,0,1
edureka!,Please mention your email id (it will not be published). We will forward the dataset to your email address.,2020-04-22T10:20:59Z,0,
Suneetha Sarikonda,Wonderful explanation,2020-04-22T06:10:23Z,0,0
SHEIKH UU,Thanks a lot 👍 mam,2020-04-21T05:06:49Z,0,0
Waleed Mohammed,"So just started this course to gain some knowledge during quarantine. 
It's been 60 mins and totally worth my time. Explaination is on another level. 👍",2020-04-20T16:28:04Z,3,0
SHEIKH UU,interesting and very helpful... thankz a lot,2020-04-20T11:41:24Z,0,0
Dimpi Sajwan,Thank you mam it just an outstanding tutorial,2020-04-17T03:25:37Z,0,0
44 Deepali Patil,Which programming platform must be used for AI??,2020-04-15T15:47:07Z,1,1
edureka!,"To be precise it depends on what problem are you trying to solve using AI. There are 5 programming languages that are widely used in AI - Python, Java, C++, LISP, Prolog",2020-04-21T07:47:51Z,0,
Jagadish Reddy Chada,The trainer is excellent and has done an outstanding job,2020-04-14T17:42:20Z,3,0
Jagadish Reddy Chada,The trainer has done outstanding job,2020-04-14T17:41:11Z,0,0
Bupe Chikumbi,Spending my quarantine learning on AI,2020-04-13T06:25:26Z,754,3
Teresa Jency Bala,me too!,2020-06-10T06:47:59Z,16,
Suku,Same here,2020-05-27T09:25:32Z,14,
Rajat Agarwal,And I am Learning in order to pass my Semester Exam...,2020-05-10T20:14:40Z,39,
Darshan Goswami,such a brilliant way to let ppl understand! amazing teacher and thank you edureka a lot.,2020-04-12T10:41:34Z,3,0
omprakash tiwari,"Thanks, A lot for this knowledgeable tutorial",2020-04-11T08:05:20Z,0,0
Jayesh Mahato,That was a good description of overall Artificial Intelligence.,2020-04-09T14:40:36Z,1,0
Armari Waterworth,Great Video!,2020-04-09T03:39:13Z,1,0
shaikh vicky,"Zulekha, u did brilliant job , u gave ur time and energy to explain AI for the beginner in a professional manner, u wer little quick in explanation but it's all right , keep up the good work, may Allah fulfil ur all desire wish,  ameen. Thanks- UAE",2020-04-08T20:13:19Z,0,0
आराध्या's मराठी vlog,Nice mam,2020-04-08T17:49:27Z,0,0
divya anand,"I am in love with this tutor. Your voice over is literally like you are speaking to me. 
1. Though this is a very lengthy video, i had no problems being glued to the screen for one full hour at a stretch, by this i mean, your SPEECH IS VERY ENGAGING. 
2. Your CONSTANT ASSURANCE that you will be explaining the new terminologies is in the upcoming slides, immediately DESTROYS the the budding DOUBT.
3. The CONTENT of the slides are EASILY UNDERSTANDABLE.
4. The SPEED at which the course is progressing is JUST RIGHT.
5.  The THOUGHT of SUBSCRIBING to your channel and the wish to LEARN whatever on earth from only YOU is occurring multiple times as i am undergoing the course.
Thanks a ton for your effort. It is certainly making the lives of many people easy.",2020-04-08T11:35:06Z,116,0
Ashok Kumar Pandey,Helpful Video Ma'am,2020-04-07T11:33:01Z,1,0
Ali Raza,"Awesome teacher, voice clear easily to understand and sweet soft voice create interest and curiosity in AI.
Such a nice platform for learning.",2020-04-05T23:53:59Z,8,0
Buno Tube ቡኖ ትዩብ,I can't stop watching even some areas are out of my scope. Wonderful!,2020-04-05T13:02:37Z,8,0
Mohd Saquib,Awesome Content ! Keep It up!,2020-04-02T14:43:07Z,1,0
Rishav Chatterjee,Please provide us the datasets used.,2020-04-01T14:51:38Z,0,1
edureka!,Please share your email id with us (it will not be published). We will forward the dataset to your email address.,2020-06-15T18:32:03Z,0,
Pro. Nagendar,"Mam,plz share the link for datasets and coding",2020-04-01T10:56:17Z,0,1
edureka!,Please share your email id with us (it will not be published). We will forward the code and dataset to your email address.,2020-06-15T18:33:35Z,0,
HANA HUB,can you pls send me dataset for this demo,2020-03-28T17:12:51Z,0,1
edureka!,Please share your email id with us (it will not be published). We will forward the dataset to your email address.,2020-06-15T18:32:14Z,0,
vartika sharma,Thanks a lot,2020-03-27T08:57:45Z,1,0
Mohammed Abdallah,Thank you,2020-03-23T13:01:08Z,0,0
The Technology Era,Nice VDO!!,2020-03-22T09:45:28Z,0,0
Luciana Mourin,"Thank you for sharing, excellent video!",2020-03-21T23:32:44Z,0,0
Amrutha varshini S,Can u please provide the link which includes Python code for these algorithms and also data sets?,2020-03-18T10:11:31Z,0,1
edureka!,Please share your email id with us (it will not be published). We will forward the code and dataset to your email address.,2020-06-15T18:28:22Z,0,
Technology TV Nepal,Thank u madam for info,2020-03-10T10:10:25Z,0,0
Tomomi .H,"Thank you for the great lecture, Subscribed!",2020-03-10T03:33:47Z,4,0
Anand Mukherjee,"Thanks alot mam 😃
You got a new subscriber 
Can plz exlp  deep machine learning 😃",2020-03-10T03:21:49Z,1,0
CiSien x,best teacher ever,2020-03-05T13:19:18Z,0,0
BARGSTON,Your voice is like virtual assistant 😁😁😁,2020-03-03T13:40:38Z,7,0
blazeup90.blogspot,"edureka is the best, school suck",2020-03-02T20:31:57Z,2,0
semira dilum Rajapaksha,Thank you 👍👍👍,2020-03-02T17:50:55Z,0,0
Nethaji R,Thank you so much for your time,2020-02-26T10:34:24Z,0,0
Sumeet Rai Batheja,pls give us more videos,2020-02-20T06:24:04Z,0,0
Aswin. J,I get some idea,2020-02-16T06:04:29Z,1,1
Aswin. J,Super,2020-02-16T06:04:44Z,0,
Syrym Zhakypbekov,I like it! Super! Keep Going!,2020-02-15T20:05:07Z,0,0
Sami David,Amazing you are amazing may god bless you 🙏,2020-02-14T10:52:01Z,1,0
Jitendra Jangid,Niceeeeeeeeeeee,2020-02-08T16:48:35Z,0,0
pragya yadav,Wonderful tutorial ! Very well organized and explained.   Well done!,2020-02-07T09:43:03Z,2,0
Pranjal Gupta,How can i get weather forecast dataset,2020-02-07T07:49:33Z,1,1
edureka!,Please share your email id with us (it will not be published). We will forward the dataset to your email address.,2020-06-15T18:32:22Z,0,
Awais Arshad,"Hello , i was just wondering that how can i get datasets that you are using ?",2020-02-05T08:23:51Z,0,1
edureka!,Please share your email id with us (it will not be published). We will forward the dataset to your email address.,2020-06-15T18:32:31Z,0,
Kehinde Aregbesola,Thanks for this beautiful video on AI,2020-01-31T12:22:58Z,1,0
Aslan,great job edureka! and can I have the datasets u used in the tutorial? especially the deep learning and classification algorithm. thank you:),2020-01-26T11:38:22Z,2,1
edureka!,Thank you. Please share your email id with us (it will not be published). We will forward the dataset to your email address.,2020-06-15T18:32:57Z,1,
Pankaj Bisoye,I love it .,2020-01-26T00:32:20Z,0,0
Praveen Varma,Good learning experience,2020-01-21T05:09:28Z,0,0
Rohan Golwalkar,One of the best videos. And the trainer is so well articulative. Kudos,2020-01-18T09:02:32Z,2,0
Nisha Vasaikar,Thank you for this crystal clear explanation.   Highly appreciate your work.   Well done.,2020-01-16T16:46:36Z,2,0
zulfiqar ali,thankyou mam i have completed this course,2020-01-15T10:48:42Z,0,0
mamta narang,Very well explained!.Thank you so much!,2020-01-14T20:37:53Z,0,0
syed shahab,This channel is such a blessing. Thank you Edureka.,2020-01-13T05:24:27Z,16,0
samidha singh,Seemed to be a machine learning course more than ai....anyhow the content was great,2020-01-13T03:56:20Z,1,0
Nguyễn Cảnh,Thank you so much,2020-01-11T23:10:54Z,0,0
Governanz,Your course is the best.,2020-01-11T16:43:57Z,1,0
Tan Nguyen,thanks for the valuable lesson,2020-01-05T22:45:59Z,0,0
TOBA TEK SINGH,In Hindi video,2020-01-04T11:40:17Z,0,0
ganesh bhurewar,nice,2020-01-01T15:07:38Z,0,0
Death Metal,Great ! Absolutely fantastic & easy explanation,2020-01-01T14:02:20Z,1,0
Моhамад Халид Аль-Кавас,Thank u so much my teacher ❤️,2019-12-30T07:20:30Z,0,0
sumit patel,Tq maam,2019-12-27T19:12:35Z,0,0
Usha Nandhini,Subscribed,2019-12-26T04:56:43Z,0,0
kabir dash,Thank you edureka,2019-12-24T05:03:02Z,0,0
GIGAKITE,"Thanks you, Splendid",2019-12-23T12:53:44Z,0,0
Tech Brillian,Thank You mam,2019-12-21T20:06:02Z,1,0
Sathely Malathi,It's an excellent video clearly abt AI n ML..,2019-12-20T06:14:40Z,0,0
When Maths Meet Coding,Your voice is super cool..,2019-12-16T11:57:50Z,1,0
Amlan Roy,34:20,2019-12-15T10:24:21Z,0,0
Sek Huat Peh,Great video for beginner to have an overview of AI!,2019-12-05T03:03:27Z,50,0
Asit Sahoo,great content,2019-12-02T05:45:28Z,2,0
mayanka bansal,"Thanks, saved a lot of time",2019-12-01T12:02:09Z,1,0
Reddy D Satyanarayana,Simply superb,2019-11-28T17:01:30Z,0,0
ahmed amigo,"Thank you very much (from Tunisia)
Just PERFECT! ♥",2019-11-27T00:18:55Z,2,0
Qodrat Aidil Akbar,09:50,2019-11-23T01:59:45Z,1,0
KhaiTri LacHong,Great video ... very helpful to enhance my on AI and how AI plays in our daily life.,2019-11-17T19:03:30Z,1,0
milimo mashini,Good stuff i highly appreciate,2019-11-16T18:36:48Z,10,0
